A2: Tezici | D2: Drevo | G2: Kov | K2: Stavající stav
K3: Abilita | L3: pocet bodu | M3: efekt
A4: + 20% nosnost | B4: 5 | D4: +10% vigour - drevo | E4: 5 | G4: +10% vigour - kov | H4: 5 | K4: Regenerace Many | L4: 20 | M4: 20 bodu/10sek
A5: + 10% vigour | B5: 5 | D5: +1 vynos z dreva | E5: 1 | G5: +1 vynos z kovu | H5: 1 | K5: Regenerace zivotu | L5: 20 | M5: 20 bodu/10sek
A6: Regenerace SP +10 | B6: 5 | D6: + ucenlivost +10% CA | E6: 5 | G6: + ucenlivost +10% BS | H6: 5 | K6: Regenerace Staminy | L6: 20 | M6: 20 bodu/10sek
A7: + ucenlivost +10% mine | B7: 5 | D7: + ucenlivost +10% BC | E7: 5 | G7: + ucenlivost +10% TK | H7: 5 | K7: Uhnuti uderu | L7: 30 | M7: 0.3
A8: + ucenlivost +10% LJ | B8: 5 | D8: + ucenlivost +10% TA | E8: 5 | G8: + 40% AR stitu | H8: 4 | K8: Absorbce | L8: 20 | M8: 0.2
A9: Blokace stitem +10% | B9: 5 | D9: Pretnuti slach | E9: 3 | G9: Regenerace HP +10 | H9: 5 | K9: Sani HP | L9: 20
A10: Prvni stupen (bile) dostupny vsem vetvim, od druheho pouze pro danou vetev a specializaci | K10: Sani Staminy | L10: 20
A11: +15% Axes | B11: 5 | D11: Oprava Archery | E11: 5 | G11: Oprava Brneni | H11: 5 | K11: Sani many | L11: 20
A12: +15% Swords | B12: 5 | D12: Oprava Holi | E12: 5 | G12: Oprava Zbrani | H12: 5 | K12: Longrange | L12: 10
A13: +15% Archery | B13: 5 | D13: Oprava TA | E13: 5 | G13: Oprava TA | H13: 5 | K13: Hazeni | L13: 10
A14: +15% Polearms | B14: 5 | D14: Vyroba Jagged Ar. | E14: 1 | G14: Vyroba pasti | H14: 1 | K14: Cesta Luku | L14: 20 | M14: 0.2
A15: +15% Crush | B15: 5 | D15: mat. JA - -50% | E15: 2 | G15: mat. past - -30% | H15: 3 | K15: Cesta Drtive sily | L15: 20 | M15: 0.2
D16: +15% dmg - rang. dmg | E16: 5 | G16: +15% dmg - melee | H16: 5 | K16: Cesta Mece | L16: 20 | M16: 0.2
K17: Cesta prvnia druhe ruky | L17: 20 | M17: 0.2
A18: Sani HP +10% | B18: 5 | D18: Material na opravy -30% | E18: 3 | G18: Material na opravy -30% | H18: 3 | K18: Strelba zubatych sipek | L18: 20 | M18: 0.9
A19: +6 HP Banda | B19: 6 | D19: Pokles mat. pri fizz -25% | E19: 5 | G19: Pokles mat. pri fizz -25% | H19: 5 | K19: Vykryti stitem | L19: 20 | M19: 0.2
A20: Recall - manacost | B20: 5 | D20: +15% vigour - drevo | E20: 5 | G20: +15% vigour - kov | H20: 5
A21: Recall - casting time | B21: 5 | G21: Kovani mith | H21: 1
A22: +25% dmg - archery | B22: 5 | D22: -10% drevenych surovin | E22: 5 | G22: -10% kov. surovin | H22: 5
A23: +5 skill podm.100% | D23: +5 skill podm.100% | G23: +5 skill podm.100% | L23: =SUM(L4:L22) -> 310
A24: Mastery Mining +5% | B24: 5 | D24: Mastery BC +5% | E24: 5 | G24: Mastery BS +5% | H24: 5
A25: Mastery LJ +5% | B25: 5 | D25: Mastery CA +5% | E25: 5 | G25: Mastery TK +5% | H25: 5 | K25: SE
A26: Detekce zil rudy | B26: 5 | D26: Mastery TA +5% | E26: 5 | G26: Mastery TA +5% | H26: 5 | K26: Abilita | L26: pocet bodu | M26: efekt | N26: Talenty
A27: + Dosah detekce | B27: 5 | D27: Detekce lepsiho dreva | E27: 5 | G27: Detekce zil rudy | H27: 5 | K27: Regenerace Many | L27: 10 | M27: 10 bodu/10sek | N27: +update na 20
A28: +25% dmg - melee | B28: 5 | D28: + Dosah detekce | E28: 5 | G28: + Dosah detekce | H28: 4 | K28: Regenerace zivotu | L28: 10 | M28: 10 bodu/10sek | N28: +update na 20
D29: podpisy | G29: Podpisy | K29: Regenerace Staminy | L29: 10 | M29: 10 bodu/10sek | N29: +update na 20
A30: +20% vigour | B30: 5 | D30: Specializace Archery | E30: 5 | G30: Specializace Mec | H30: 5 | K30: Uhnuti uderu | L30: 30 | M30: 0.3
A31: Detekce lepsiho dreva | B31: 5 | D31: Specializace crushing | E31: 5 | G31: Specializace Sekera | H31: 5 | K31: Absorbce | L31: 20 | M31: 0.2
A32: + Dosah detekce | B32: 5 | D32: Specializace magery /2 | E32: 5 | G32: Specializace crushing | H32: 5 | K32: Sani HP | L32: 20 | M32: 20% z rány | N32: +update na 30%
A33: Odstran zaval | B33: 5 | D33: Specializace crook /4 | E33: 5 | G33: Specializace polearms | H33: 5 | K33: Sani Staminy | L33: 20 | M33: 20% z rány
A34: + zavaly | B34: 5 | D34: Superior vyrobek - drevo | E34: 5 | G34: Superior vyrobek - kov | H34: 5 | K34: Sani many | L34: 20 | M34: 20% z rány
K35: Longrange | L35: 10
A36: Mith | B36: 1 | K36: Hazeni | L36: 10
A37: Elven | B37: 1 | D37: Vyroba - elven | E37: 1 | G37: Vyroba - mithril | H37: 1 | K37: Strelba zubatych sipek | L37: 10 | M37: 0.9
K38: Blokace stitem | L38: 10 | M38: 0.1
B39: =SUM(B4:B37) -> 133 | E39: =SUM(E4:E37) -> 116 | H39: =SUM(H4:H37) -> 118 | K39: Dmg za lvl - PvM | L39: 150 | M39: 1
L40: =SUM(L27:L39) -> 330
A42: Poznamka: | B42: ceny abilit budou nakonec stanoveny v absolutnich hodnotach, nikoliv v %
A43: Talenty | B43: Popis
A44: Vigour | B44: - Aktivni abilita, bez CD - aktivita zere staminu, pri stamina = 0 se vypne - sance nalezt o 1 lepsi material
A45: Odstran zavaly | B45: - Aktivni abilita, CD 30 minut, 100% staminy - 95% sance na odstraneni urcene zavalu - upgrade na 8 poli kolem krafta (75% sance)
A46: Blokace stitem | B46: - Pasivni abilita pokud je equipnut stit - 10x body v abilite ---> sance 20% snizit PvM dmg o procentni cast dle materialu - Copper shield - 15, 20, 25, 30, 35, 40 a 50%
A47: Superior vyrobek | B47: - pasivni ablitita - sance 5% ze vyrobeny vyrobek bude mit superior vlastnosti - superior vlastnost = +30% durabilita
A48: Detekce zil rudy | B48: - aktivni ablitita, CD 30 minut, max 30 sekund, vyzaduje mining mastery - zapnuty talent razantne spotrebovava staminu, pri stam = 0 se vypina - craft vidi v urcitem dosahu kolem sebe mista, kde muze byt lepsi ruda (neni to 100%)
A49: Detekce lepsiho dreva | B49: - aktivni ablitita, CD 30 minut, max 30 sekund, vyzaduje LJ mastery - zapnuty talent razantne spotrebovava staminu, pri stam = 0 se vypina - craft vidi v urcitem dosahu kolem sebe stromy, kde muze byt lepsi drevo (neni to 100%)
A50: Pokles mat. pri fizz | B50: - aktivni ablitita, bez CD - zapnuty talent spotrebovava staminu, pri nedostatku staminy se automaticky vypina. - 90% sance, ze ztrata materialu pri neuspesne vyrobe poklesne o 25%
A51: Specializace | B51: - aktivni ablitita, bez CD - zapnuty talent spotrebovava staminu, pri nedostatku staminy se automaticky vypina. - sance level/200, ze bude vyroben podepsany vyrobek
A52: System specializace | B52: - sekery, mece, kladiva, hole, polearms, kuse, luky - vylepseni +20% prislusny skill - croak - +5% taming - kouzelne hole - +10% magery
A53: -10% surovin | B53: - pasivni ablitita - snizuje o 10% narocnost na vyrobu u prislusneho materialu
A54: Regenerace HP, SP a MP | B54: - pasivni abilita - 1x bod ability = 1 regenerovany bod za 10 sekund - talenty je mozny upgrade (1x abilita = 2 regenerovane body)
A55: Uhnuti uderu | B55: - pasivni abilita - sance, ze postava zcela uhne uderu (melee nebo archery) - ruzna povolani maji ruzny strop (20-40%)
A56: Absorbce kouzla | B56: - pasivni abilita - sance, ze postava zcela absorbuje magicke dmg - ruzna povolani maji ruzny strop (20-40%)
A57: Sani HP, MP a SP | B57: - pasivni abilita - sance, ze postava uderem, kouzlem vysaje prislusne body z monstra (20% z rany, ale zaroven I porovnovat se stropem pro sani) - talenty je mozny upgrade
A58: Longrange | B58: - aktivni abilita, CD 2 minuty, sezere 1/2 maxstaminy, trva 10 sekund - Ranger/zlodej - prodluzuje dosah + 100% fizzuje kouzla - Warior - prodluzuje dosah leapu o 2 pole - Mystik - prodluzuje dosah + 100% fizzuje kouzla (dmg bez paralyzy)
A59: Hazeni | B59: - pasivni abilita - umoznuje hazet kudly a bomby
A60: Bonus za level - damage | B60: - pasivni abilita, PvM - lze od lvlu 50, maximalne pocet bodu = lvl - 50 - kazdy bod zvedne o 0,5% PvM dmg, u kouzlivcu pres standcast.
A61: Pretnuti slach | B61: - aktivni abilita, CD 2 min, sezere 1/3 maxstaminy - sance zpomalit monstrum o 5% (craft 3%), vyzaduje ostrou zbran - monstrum muze odolat a nelze zpomalit napr. spiritu - pri dalsim uspechu se efekt scita a timer nastavuje na delku posledniho zasazeni
A62: Koncepce zpomaleni | B62: - jedno zpomaleni 5%-10% podle druhu - 1x druh zpomaleni = strop 20% - 2x druh zpomaleni = strop 30% + pomalejsi padani dolu - 3x druh zpomaleni = strop 35% + extra pomalejsi padani dolu