A2: Summoner (vamp, satan…) | D2: Caster | G2: Nekromancer (skeletoni) | K2: Stavající stav
K3: Abilita | L3: pocet bodu | M3: efekt
A4: Minions +10% dmg | B4: 5 | D4: +30% setreni | E4: 10 | G4: Bone Armor - +20% AR | H4: 5 | K4: Regenerace Many | L4: 20 | M4: 20 bodu/10sek
A5: Minions +25% HP | B5: 5 | D5: Fire skola +15% dmg | E5: 5 | G5: Mana Shield | H5: 5 | K5: Regenerace zivotu | L5: 20 | M5: 20 bodu/10sek
A6: +2 summon | B6: 2 | D6: Acid skola +15% dmg | E6: 5 | G6: MS - absorbce + 40% | H6: 5 | K6: Regenerace Staminy | L6: 20 | M6: 20 bodu/10sek
A7: Gr. Vampyr | B7: 5 | D7: Meditace +50% mana | E7: 5 | G7: + ucenlivost +10% Inscr | H7: 5 | K7: Uhnuti uderu | L7: 20 | M7: 0.2
A8: +25% dmg Gvamp | B8: 5 | D8: Regenerace MP +10 | E8: 5 | G8: + ucenlivost +10% Alch | H8: 5 | K8: Absorbce | L8: 40 | M8: 0.4
A9: Regenerace HP +10 | B9: 5 | D9: Sani SP +10% | E9: 5 | G9: Regenerace SP +10 | H9: 5
A10: Satan | B10: 5 | D10: Unava/ vycerpani | E10: 5 | G10: Mana do hole +40% | H10: 5 | K10: Sani HP | L10: 20
A11: Prvni stupen (bile) dostupny vsem vetvim, od druheho pouze pro danou vetev a specializaci | K11: Sani Staminy | L11: 20
A12: Sani many z Minions | B12: 5 | D12: Standcast - posileni | E12: 5 | G12: Animate | H12: 5 | K12: Sani many | L12: 20
A13: +2 Minions | B13: 2 | D13: +15% setreni many | E13: 5 | G13: Zvysena reg. many - aktiv. | H13: 5 | K13: Longrange | L13: 10
A14: Satan +25%HP | B14: 5 | D14: +1 summon | E14: 1 | G14: +3 Undeads | H14: 3 | K14: Hazeni | L14: 10
A15: Satan +25% pohyb | B15: 5 | D15: Earthq - +15% dosah | E15: 5 | G15: Undeads - +15%HP | H15: 3 | K15: Energy shield | L15: 50 | M15: 350 HP
A16: Minions -20% mana | B16: 5 | D16: Fire - 20% manacost | E16: 5 | G16: Earth - 20% manacost | H16: 5
A17: Fire - 20% manacost | B17: 5 | D17: Earth - 20% manacost | E17: 5 | G17: Animate -20% manacost | H17: 5
L18: =SUM(L4:L17) -> 250
A19: Satan +20% dmg | B19: 5 | D19: Sani MP +10% | E19: 5 | G19: Animate +30 sekund | H19: 5
A20: Satan +20% agro | B20: 5 | D20: Poison - Acidblast | E20: 5 | G20: Undeads +25% pohyb | H20: 5
A21: Ignition - Firewall | B21: 5 | D21: Poison - efekt 5% | E21: 5 | G21: Poison - Acidblast | H21: 5
A22: Ignition - efekt 5% | B22: 5 | D22: Acid nova -20% casting | E22: 5 | G22: Poison - efekt 5% | H22: 5
A23: Earthq -10% casting | B23: 5 | D23: Earthq -10% casting | E23: 5 | G23: Acid nova -20% castingtime | H23: 5
K24: SE
A25: Mamrd (max 1x) | B25: 5 | D25: Ignition - Fireball | E25: 5 | G25: Animate - stabilita | H25: 5 | K25: Abilita | L25: pocet bodu | M25: efekt
A26: Mamrd +25% pohyb | B26: 5 | D26: Ignition - efekt 5% | E26: 5 | G26: Animate sniz ubytek many | H26: 5 | K26: Regenerace Many | L26: 10 | M26: 10 bodu/10sek
A27: Mamrd +25% dmg | B27: 5 | D27: Magery mastery +5% | E27: 5 | G27: Undeads +20% dmg | H27: 5 | K27: Regenerace zivotu | L27: 10 | M27: 10 bodu/10sek
A28: summons +20% agro | B28: 5 | D28: Horrifying sight | E28: 5 | G28: Skeleton knight | H28: 5 | K28: Regenerace Staminy | L28: 10 | M28: 10 bodu/10sek
K29: Uhnuti uderu | L29: 20 | M29: 0.2
A30: Fire skola +20% dmg | B30: 5 | D30: Direkt kouzla +15%dmg | E30: 5 | G30: Earth skola +20% dmg | H30: 5 | K30: Absorbce | L30: 40 | M30: 0.4
A31: Mamrd +25% resist | B31: 5 | D31: Silence | E31: 5 | G31: Animate +10% dmg | H31: 5 | K31: Sani HP | L31: 10 | M31: 10% z rány | N31: upgrade na 20%
A32: Mamrd -20% mana | B32: 5 | D32: Silence - zkraceni CD | E32: 5 | G32: Animate +1 pet | H32: 1 | K32: Sani Staminy | L32: 10 | M32: 10% z rány | N32: upgrade na 20%
A33: Mamrd -scream | B33: 5 | D33: Energyshield - posileni | E33: 5 | G33: Skeleton knight - scream | H33: 5 | K33: Sani many | L33: 10 | M33: 10% z rány | N33: upgrade na 20%
K34: Longrange | L34: 10
A35: Summon - frenzy | B35: 1 | D35: Spell boost | E35: 1 | G35: Undeads - deathshield | H35: 1 | K35: Hazeni | L35: 10
K36: Standcast | L36: 10
K37: Energy shield | L37: 30
B38: =SUM(B4:B35) -> 125 | E38: =SUM(E4:E35) -> 132 | H38: =SUM(H4:H35) -> 123
A39: Nekro | K39: Dmg za lvl | L39: 150 | M39: 1
A40: zaklad 1x summon | D40: Nekro summoni | L40: =SUM(L26:L39) -> 330
A41: kazdy umi skeletony | D41: 1* Minions (demon, vamp, satan...)
A42: neumi animals | D42: 2* undeads (skeletons, kun, mummy...) | K42: para resist snizeni
A43: neumi elementals | D43: 3* Animate | K43: agro snizeni
A45: Poznamka: | B45: ceny abilit budou nakonec stanoveny v absolutnich hodnotach, nikoliv v %
A46: Talenty - Aktivni | B46: Popis
A47: Koncepce zpomaleni | B47: - jedno zpomaleni 5%-10% podle druhu - 1x druh zpomaleni = strop 20% - 2x druh zpomaleni = strop 25% + pomalejsi padani dolu - 3x druh zpomaleni = strop 35% + extra pomalejsi padani dolu | J47: Kouzlo - 10% zapomaleni/kouzlo Jed - 5% zapomaleni /uder Uder - 7% zapomaleni / uder
A48: Unava/ vycerpani (jen PvM) | B48: - Kouzlo, PvM - snizi pohyb monstra o 10% - pri dalsim uspechu se efekt scita a timer nastavuje na delku posledniho zasazeni
A49: Mamrd | B49: - Kouzlo - Pracovni nazev summona - dostupny a boostovatelny pouze ve vetvi Summonera - vyvolan muze byt pouze 1x
A50: Skeleton knight | B50: - Kouzlo - Pracovni nazev nejvyssiho summona nekromanta - dostupny a boostovatelny pouze ve vetvi Nekromancie - vyvolan muze byt pouze 5x
A51: Animate (jen PvM) | B51: - Kouzlo: oziveni monstra a ovladani jej jako summona - k zakouzleni potreba regy a manu dle narocnosti monstra - udrzeni monstra zere manu (dle narocnosti), mana=0 nebo time ---> splaseni monstra - sance (dle narocnosti) na selhani animate (splaseni)
A52: Summon frenzy | B52: - Docasny boost dmg summonu (pripadne HP summonu) - 30 sekund - V prubehu spotrebovava staminu, pri nedostatku staminy se automaticky vypina. - CD 20 minut
A53: Ignition / Poison | B53: - Aktivni abilita, spotrebovava manu, bez CD - Sance u prislusneho kouzla na zapaleni/otravu cile - cil na sobe ma DOT dmg, kteru postupne slabne - pri dalsim uspechu se DOT scitaji a timer nastavuje na delku posledniho zasazeni (jako bleed)
A54: Setreni many | B54: - aktivni ablitita, bez CD - sance na to, ze pri supechu je vraceno 90% many z vyvolaneho kouzla - zapnuty talent spotrebovava staminu, pri nedostatku staminy se automaticky vypina.
A55: Sani many ze summonu | B55: - aktivni ablitita, CD 2 minuty - zapnuty talent spotrebovava staminu, pri nedostatku staminy se automaticky vypina. - pri zapnuti se nekromantovi zvysi manaregen, velikost zavisla na aktualnim poctu summonu
A56: Spellboost | B56: - aktivni ablitita, CD 15 minut - zapnuty talent spotrebovava staminu, pri nedostatku staminy se automaticky vypina. - po dobu 20 sekund zvyseno dmg z kouzel o 50%
A57: Zvysena reg. many | B57: - aktivni ablitita, CD 20 minut - zapnuty talent spotrebovava staminu, pri nedostatku staminy se automaticky vypina. - po dobu aktivity se regenerace (abilita) ztrojnasobuje, nebere v potaz itemy!
A58: Undeads - Deathshield | B58: - na 60 sekund je skeletonum nekromanta zvednuty resisty na 80% (vyjma resistu na dispel) - V prubehu spotrebovava staminu, pri nedostatku staminy se automaticky vypina. - CD 20 minut
A59: Standcast (jen PvM) | B59: - do dmg kouzla je pripocten bonus za lvl castera, PvM only - v prubehu kouzla neni mozny pohyb, fizz kouzla = prodlouzeni freezetimeru o 3 sek - nutno aktivovat pred kazdym kouzlem (aktivace 5% max staminy)
A60: Animate redukce ubytku many | B60: - Aktivni abilita, CD 10 min, max 1 minuta - zapnuty talent spotrebovava staminu, pri nedostatku staminy se automaticky vypina. - po dobu aktivity se narocnost na manu u animate snizuje o 40%
A61: Energy shield | B61: - Aktivni abilita, CD 4 min - Stit vykryva kouzla i rany - pouze PvM, HP stitu dle bodu v abilite (1=30 HP) - behem kouzla neni mozny pohyb a standcast, dale gatetravel a recall - stoji 1x amethyst, ubira 60 many
A62: Longrange | B62: - aktivni abilita, CD 2 minuty, sezere 1/2 maxstaminy, trva 10 sekund - Ranger/zlodej - prodluzuje dosah + 100% fizzuje kouzla - Warior - prodluzuje dosah leapu o 2 pole - Mystik - prodluzuje dosah + 100% fizzuje kouzla (dmg bez paralyzy)
A63: Silence | B63: - aktivni abilita, CD 10 minut (po upgradu 5 minut) - target nemuze po dobu 5 sekund kouzlit - aktivace jednorazove stoji celou maxstaminy
A64: Manashield | B64: - aktivni abilita, bez CD, PvP - po zapnuti jsou misto HP ubirany MP, max 1 min. - zakouzleni kouzla shazuje manashield
A65: Mamrd /skel. knight scream | B65: - abilita summona, 1 min - vsechna monstra v dosahu obrati pozornost na summona - uspesnost zavisla na vzdalenosti a na monstru
A66: Horrifying sight | B66: - aktivni abilita, PvM, 90% stamina - vydesi monstrum, ze na dobu 3 sekundy strne (kazdy dmg strnuti prolomi) - uspesnost zavisla na SM castera (+ bonus za lvl) a na obrane monstra
A68: Talenty - Aktivni | B68: Popis
A69: Absorbce kouzla | B69: - pasivni abilita - sance, ze postava zcela absorbuje magicke dmg - ruzna povolani maji ruzny strop (20-40%)
A70: Sani HP, MP a SP | B70: - pasivni abilita - sance, ze postava uderem, kouzlem vysaje prislusne body z monstra (20% z rany, ale zaroven I porovnovat se stropem pro sani) - talenty je mozny upgrade
A71: Bonus za level - damage | B71: - pasivni abilita, PvM, v podobe standcastu - lze od lvlu 50, maximalne pocet bodu = lvl - 50 - kazdy bod zvedne o 0,5% PvM dmg, u kouzlivcu pres standcast.
A72: Hazeni | B72: - pasivni abilita - umoznuje hazet kudly a bomby
A73: Regenerace HP, SP a MP | B73: - pasivni abilita - 1x bod ability = 1 regenerovany bod za 10 sekund - talenty je mozny upgrade (1x abilita = 2 regenerovane body)
A74: Uhnuti uderu | B74: - pasivni abilita - sance, ze postava zcela uhne uderu (melee nebo archery) - ruzna povolani maji ruzny strop (20-40%)