A2: Healer/Lecitel | D2: Kouzla dmg | G2: Voodoo | K2: Stavající stav
K3: Abilita | L3: pocet bodu | M3: efekt
A4: Regenerace HP +10 | B4: 5 | D4: Regenerace MP +10 | E4: 5 | G4: Regenerace SP +10 | H4: 5 | K4: Regenerace Many | L4: 20 | M4: 20 bodu/10sek
A5: Nosnost +20% | B5: 5 | D5: Sani MP +10% | E5: 5 | G5: Sani SP +10% | H5: 5 | K5: Regenerace zivotu | L5: 20 | M5: 20 bodu/10sek
A6: Lifepakt +HP 50% | B6: 5 | D6: Lifepakt +MP 50% | E6: 5 | G6: Lifepakt +SP 50% | H6: 5 | K6: Regenerace Staminy | L6: 20 | M6: 20 bodu/10sek
A7: Doublebandage +20% | B7: 5 | D7: Manatransfer - 1:1 MP | E7: 5 | G7: Bloodritual | H7: 5 | K7: Uhnuti uderu | L7: 30 | M7: 0.3
A8: Unava/ vycerpani | B8: 5 | D8: Mana Shield | E8: 5 | G8: Blood pakt | H8: 5 | K8: Absorbce | L8: 30 | M8: 0.3
A9: Voodoo - boosty | B9: 1 | D9: Voodoo - silence | E9: 1 | G9: Voodoo - shield | H9: 1 | K9: Sani HP | L9: 20
A10: Protection of Elements | B10: 5 | D10: Curse of Elements -10% | E10: 5 | G10: Voodoo - curse | H10: 1
A11: Agro - 15% | B11: 5 | D11: Direkt +10% dmg | E11: 5 | G11: Voodoo - armor | H11: 1 | K11: Sani Staminy | L11: 20
A12: Meditace +50% mana | B12: 5 | D12: Mana do hole +40% | E12: 5 | G12: + ucenlivost +10% Cook | H12: 5 | K12: Sani many | L12: 20
A13: Prvni stupen (bile) dostupny vsem vetvim, od druheho pouze pro danou vetev a specializaci | K13: Longrange | L13: 10
A14: Voodoo - boosty +30% | B14: 5 | D14: Zvysena reg. many - aktiv. | E14: 5 | G14: Voodoo - control | H14: 1 | K14: Hazeni | L14: 10
A15: Doublebandage +20% | B15: 5 | D15: +zkraceni CD -10min | E15: 5 | G15: Voodoo shield CD -5min | H15: 5 | K15: Voodoo | L15: 10 | M15: 0.95 | N15: od lvlu 30
A16: Voodoo shield CD -5min | B16: 5 | D16: Standcast - posileni | E16: 5 | G16: Voodoo shield +100% | H16: 5 | K16: Bloodpakt | L16: 10 | M16: 0.1
A17: Voodoo shield +100% | B17: 5 | D17: Restoration - MP | E17: 5 | G17: Restoration - SP | H17: 5
A18: Restoration - HP | B18: 5 | D18: +zvyseni efektu 100% | E18: 5 | G18: +zvyseni efektu 50% | H18: 5 | K18: Vykryti stitem | L18: 20 | M18: 0.2
A19: +zvyseni efektu 100% | B19: 5 | D19: Frost skola +15%dmg | E19: 5 | G19: Energy field - 25% mana | H19: 5 | K19: Voodoo shield | L19: 50 | M19: 0.3
A20: Vykrytí štítem + 5% | B20: 5 | D20: Earth skola +15%dmg | E20: 5 | G20: Vykrytí štítem + 5% | H20: 5 | K20: Lifepakt | L20: 10 | M20: 0.9
K21: Lifepakt - HP | L21: 20 | M21: 1
A22: Doublebandage +20% | B22: 5 | D22: Freeze - frostnova | E22: 5 | G22: Doublebandage +20% | H22: 5 | K22: Lifepakt - MP | L22: 20 | M22: 1
A23: Frost skola +20%dmg | B23: 5 | D23: Freeze - efekt 10% | E23: 5 | G23: Earth skola +20%dmg | H23: 5 | K23: Lifepakt - SP | L23: 20 | M23: 1
A24: PoE - Frost +100% | B24: 5 | D24: Corrode - Acidblast | E24: 5 | G24: PoE - Earth +100% | H24: 5
A25: PoE - Fire +100% | B25: 5 | D25: Corrode - efekt 5% | E25: 5 | G25: PoE - Air +100% | H25: 5 | L25: =SUM(L4:L24) -> 360
A26: Lifepakt +HP 50% | B26: 5 | D26: Lifepakt +MP 50% | E26: 5 | G26: Lifepakt +SP 50% | H26: 5
K27: SE
A28: Magery mastery +10% | B28: 5 | D28: Magery mastery +5% | E28: 5 | G28: Lifepakt -15 minut CD | H28: 5
A29: Resurrection | B29: 5 | D29: Zrcadlo | E29: 5 | G29: Voodoo shield - melee | H29: 5 | K29: Abilita | L29: pocet bodu | M29: efekt
A30: Resurrection -20%mana | B30: 5 | D30: Manatransfer - 1:1,5 MP | E30: 5 | G30: Paralyze +10% sance | H30: 5 | K30: Regenerace Many | L30: 10 | M30: 10 bodu/10sek
A31: Freeze - frostnova | B31: 5 | D31: PoE - jednotlive skoly +50% | E31: 5 | G31: Corrode - Acidblast | H31: 5 | K31: Regenerace zivotu | L31: 10 | M31: 10 bodu/10sek
A32: Freeze - efekt 10% | B32: 5 | D32: Acid Cloud -20% castingtime | E32: 5 | G32: Corrode - efekt 5% | H32: 5 | K32: Regenerace Staminy | L32: 10 | M32: 10 bodu/10sek
K33: Uhnuti uderu | L33: 30 | M33: 0.3
A34: Voodoo - protection | B34: 5 | D34: CoE - fire, earth -15% | E34: 5 | G34: Voodoo - Dominance | H34: 5 | K34: Absorbce | L34: 30 | M34: 0.3
A35: + mass verze | B35: 5 | D35: CoE - frost, air - 15% | E35: 5 | G35: + 50% efekt | H35: 5 | K35: Sani HP | L35: 10 | M35: 10% z rány | N35: upgrade na 20%
A36: CoE - frost, air - 15% | B36: 5 | D36: Unava/ vycerpani - mass | E36: 5 | G36: CoE - fire, earth -15% | H36: 5 | K36: Sani Staminy | L36: 10 | M36: 10% z rány | N36: upgrade na 20%
A37: Voodoo - armor +100% | B37: 5 | D37: Voodoo - Silence -5 min CD | E37: 5 | G37: Voodoo - armor +100% | H37: 5 | K37: Sani many | L37: 10 | M37: 10% z rány | N37: upgrade na 20%
K38: Longrange | L38: 10
A39: Bandage - swiftness | B39: 1 | D39: Voodoo - Spell Power | E39: 1 | G39: Bloodpakt +100% | H39: 1 | K39: Hazeni | L39: 10
K40: Standcast | L40: 10
K41: Voodoo | L41: 10
B42: =SUM(B4:B39) -> 147 | E42: =SUM(E4:E39) -> 147 | H42: =SUM(H4:H39) -> 135 | K42: Lifepakt | L42: 10 | M42: 0.9
K43: Blokace stitem | L43: 10 | M43: 0.2
K44: Dmg za lvl | L44: 150 | M44: 1
L45: =SUM(L30:L44) -> 330
A47: Poznamka: | B47: ceny abilit budou nakonec stanoveny v absolutnich hodnotach, nikoliv v %
A48: Talenty | B48: Popis
A49: Voodoo | B49: - pasivni abilita potrena k provozovani voodoo talentu - Od levelu 5
A50: Lifepakt | B50: - aktivni abilita, CD 60 (45) minut, 100% maxstamina - shaman vytvori "Dusi", umoznujici oziveni (90%) hrace, ktery ji ma u sebe (i shaman) - duse vydrzi 20 minut, je treba nadobka. - oziveni az 20 sekund po smrti, po oziveni ma 1xHP,SP, MP (upgr. 100%)
A51: Bloodpakt | B51: - Aktivni abilita (on/off), spotrebovava staminu, CD 5 minut, max 180 sek. - propojeni hracu a prenos 10% dmg - funguje obousmerne - upgrade: z cile prenos 20%, shaman ztrata 10% - pri utoku na hrace jinym hracem, je je spojeni zruseno (nebo smrti).
A52: Corrode | B52: - Aktivni abilita (on/off), spotrebovava manu, bez CD - 10% Sance u kouzla Acidblast, na docasne snizeni armoru o 5% - pri dalsim uspechu se efekt nescita, timer se nastavuje na delku posledniho zasazeni
A53: Freeze Frostnova | B53: - Aktivni abilita (on/off), spotrebovava manu, bez CD - 10% Sance u kouzla Frostnova, ze zmrazi cil na 3 sek. (rana prolomi) - pri dalsim uspechu se efekt nescita, timer se nastavuje na delku posledniho zasazeni
A54: Manatransfer | B54: - aktivni abilita, bez CD - 50 HP je transformovano do MP, pomer 1:1 (uprade 1,5) - potrebna ada dyka, amber (ritual) = 10x nabiti pro transfer - Abilitou je mozno se zabit.
A55: Bloodritual | B55: - aktivni abilita, CD 2 minuty, 1/2 maxstamina - shaman transformuje 30 bodu Vit do 30 INT
A56: Doublebandage | B56: - aktivni ablitita (on/off), bez CD - zapnuti sezere 10 staminy, talent spotrebovava staminu (spotrebu lze upgradnout). - pri zapnute abilite se zvetsuje pocet vylecenych zivotu (ne sebe)
A57: Zvysena reg. many | B57: - aktivni ablitita, CD 20 (10) minut - zapnuty talent spotrebovava staminu, pri nedostatku staminy se automaticky vypina. - po dobu aktivity se regenerace (abilita) ztrojnasobuje, nebere v potaz itemy!
A58: Bandage - Swiftness | B58: - aktivni ablitita, CD 10 minut - zapnuty talent spotrebovava staminu, pri nedostatku staminy se automaticky vypina. - po dobu aktivity (15 sekund) se prodleva bandage zkracuje o 50%. Narocne na staminu
A59: Voodoo - Protection /mass | B59: - aktivni abilita, CD 5 min, sezere 1/2 maxstaminy, Req: voodoo - zapnuty talent spotrebovava staminu - abilita umoznuje ochranit cil/skupinu pred demony (vcetne sebe) - Efekt: -15% zraneni zpusobeneho demony, 60 sekund | K59: Voodoo - protection --->Pripadne verze na zvednuti PvM AR
A60: Voodoo - Silence | B60: - aktivni abilita, CD 7 (5) minut, Req: voodoo - target nemuze po dobu 5 sekund kouzlit, PvM - 100 staminy
A61: Voodoo - Boosty | B61: - aktivni abilita, bez CD, Req: voodoo, 30 stam - shaman je schopen pozitivne naboostit cil i sebe prostrednictvim hlavy cile. - STR, INT, VIT, DEX - o hodnotu X + upgrade 30%
A62: Voodoo - Curse | B62: - PvP abilita, CD 2,5 minut, Req: voodoo + 30 lvl, 60 stam - schopnost prostrednictvim hlavy cile proklit nepritele - efekty dle kudel (dmg, poison,bleed, no horse...) - casove varovani, behem nehoz lze odvratit prokleti zrcadlem, posleze jen pozehnanim
A63: Voodoo - Dominance | B63: - aktivni ablitita/kouzlo, CD 5 minut, 1/2 maxstamina, Req: voodoo - Zpusobi, ze humanoidni monstrum je o 10% (15%) vice zranitelne
A64: Voodoo - Control | B64: - aktivni ablitita, CD 90 sek, Req: voodoo - pouziti bere saminu, cim narocnejsi monstrum tim vic staminy, 50% sance ze monstrum zautoci - cim vyssi level, tim narocnejsi monstrum jste schopni kontrolovat
A65: Voodoo - Spell power | B65: - aktivni ablitita, CD 25 minut, 1/2 staminy, Req: voodoo - zapnuty talent spotrebovava staminu, pri nedostatku staminy se automaticky vypina. - po dobu 20 sekund zvyseno dmg z kouzel o 50%
A66: Voodoo - Armor | B66: - abilita,bez CD, Req: voodoo - Navyseni PvM armoru, dispelnutelne - v zakladu 10% (20%) obleceneho armoru
A67: Voodoo - Shield | B67: - Aktivni abilita, CD 7 (2) minuty, Req: voodoo - Stit vykryva pouze kouzla - pouze PvM, stit = 150 (300) HP - behem kouzla neni mozno kouzlit gatetravel a recall - stoji 1x citrin, ubira 1/4 staminy
A68: Voodoo - Shield upgrade - melee | B68: - Pasivni abilita - upgrade Voodoo shieldu - 10% sance ze voodoo shield pohlti i melee/archery dmg - 40% dmg pohlti stit a zbytek zrani normalne.
A69: Zvysena reg. many | B69: - aktivni ablitita, CD 2 minuty - zapnuty talent spotrebovava staminu, pri nedostatku staminy se automaticky vypina. - po dobu aktivity se regenerace (abilita) ztrojnasobuje, nebere v potaz itemy!
A70: Restoration SP,MP,HP | B70: - aktivni abilita, CD 2 minuty, 1/4 stamina - cil (mozno I sam sobe) o 50% (75/100%) vice regeneruje MP,SP nebo HP po dobu 1 minuty - nelze dispelnout
A71: Standcast | B71: - do dmg kouzla je pripocten bonus za lvl castera, PvM only - v prubehu kouzla neni mozny pohyb, fizz kouzla = prodlouzeni freezetimeru o 3 sek - nutno aktivovat pred kazdym kouzlem (aktivace 5% max staminy)
A72: Protection of Elements | B72: - kouzlo, dispelnutelne - ochrana pred danou skolou, aktivni muze byt pouze jedna ochranna skola - dmg zpusobene danou skolou od monster je snizeno o 10% (20%)
A73: Curse of Elements | B73: - kouzlo, dispelnutelne, nefunguje na imunni monstra na danou skolu - ochrana monster pred danou skolou je snizena o 10 (15%), monstrum muze odolat - trvani: 2 minuty
A74: Regenerace HP, SP a MP | B74: - pasivni abilita - 1x bod ability = 1 regenerovany bod za 10 sekund - talenty je mozny upgrade (1x abilita = 2 regenerovane body)
A75: Uhnuti uderu | B75: - pasivni abilita - sance, ze postava zcela uhne uderu (melee nebo archery) - ruzna povolani maji ruzny strop (20-40%)
A76: Absorbce kouzla | B76: - pasivni abilita - sance, ze postava zcela absorbuje magicke dmg - ruzna povolani maji ruzny strop (20-40%)
A77: Sani HP, MP a SP | B77: - pasivni abilita - sance, ze postava uderem, kouzlem vysaje prislusne body z monstra (20% z rany, ale zaroven I porovnovat se stropem pro sani) - talenty je mozny upgrade
A78: Longrange | B78: - aktivni abilita, CD 2 minuty, sezere 1/2 maxstaminy, trva 10 sekund - Ranger/zlodej - prodluzuje dosah + 100% fizzuje kouzla - Warior - prodluzuje dosah leapu o 2 pole - Mystik - prodluzuje dosah + 100% fizzuje kouzla (dmg bez paralyzy)
A79: Hazeni | B79: - pasivni abilita - umoznuje hazet kudly a bomby
A80: Blokace stitem | B80: - Pasivni abilita pokud je equipnut stit - 10x body v abilite ---> sance 20% snizit PvM dmg o procentni cast dle materialu (Copper shield - 15, 20, 25, 30, 35, 40 a 50%)
A81: Manashield | B81: - aktivni abilita, bez CD, PvP - po zapnuti jsou misto HP ubirany MP, max 1 min. - zakouzleni kouzla shazuje manashield
A82: Bonus za level - damage | B82: - pasivni abilita, PvM - lze od lvlu 50, maximalne pocet bodu = lvl - 50 - kazdy bod zvedne o 0,5% PvM dmg, u kouzlivcu pres standcast.
A83: Unava/ vycerpani | B83: - Kouzlo, PvM - snizi pohyb monstra o 10% - pri dalsim uspechu se efekt scita a timer nastavuje na delku posledniho zasazeni - uprade - 10% sance na stun 2 sek (dmg jej prolomi)
A84: Unava/ vycerpani mass | B84: - Kouzlo (delsi casting time a mana), PvM - snizi pohyb monstra o 10%, mass efekt (uspesnost zavisla na vzdalenosti) - pri dalsim uspechu se efekt scita a timer nastavuje na delku posledniho zasazeni
A85: Koncepce zpomaleni | B85: - jedno zpomaleni 5%-10% podle druhu - 1x druh zpomaleni = strop 20% - 2x druh zpomaleni = strop 25% + pomalejsi padani dolu - 3x druh zpomaleni = strop 35% + extra pomalejsi padani dolu