A2: Ambush | D2: Melee | G2: Support | K2: Stavající stav
K3: Abilita | L3: pocet bodu | M3: efekt
A4: Regenerace MP +10 | B4: 5 | D4: Regenerace HP +10 | E4: 5 | G4: Regenerace SP +10 | H4: 5 | K4: Regenerace Many | L4: 20 | M4: 20 bodu/10sek
A5: Sani SP +10% | B5: 5 | D5: Sani HP +10% | E5: 5 | G5: Nosnost +20% | H5: 5 | K5: Regenerace zivotu | L5: 20 | M5: 20 bodu/10sek
A6: Utok zezadu +20% dmg | B6: 5 | D6: Agro - 15% | E6: 5 | G6: Agro +30% | H6: 5 | K6: Regenerace Staminy | L6: 20 | M6: 20 bodu/10sek
A7: Archery +10% dmg | B7: 5 | D7: swords +10% dmg | E7: 5 | G7: crushing +10% dmg | H7: 5 | K7: Uhnuti uderu | L7: 40 | M7: 0.4
A8: Longrange - CD -1 min | B8: 5 | D8: Disarm - uder | E8: 5 | G8: Zaujmuti monstra | H8: 5 | K8: Absorbce | L8: 20 | M8: 0.2
A9: + ucenlivost +10% alch. | B9: 5 | D9: Bleed + 20% dmg (i pvp) | E9: 5 | G9: + ucenlivost +10% lockp. | H9: 5 | K9: Sani HP | L9: 20
A10: Prvni stupen (bile) dostupny vsem vetvim, od druheho pouze pro danou vetev a specializaci | K10: Sani Staminy | L10: 20
G11: Odrazeni kouzla stit. | H11: 5 | K11: Sani many | L11: 20
G12: + zkraceni CD | H12: 5 | K12: Longrange | L12: 10
A13: Zrychleni uderu - Crush | B13: 5 | D13: Zrychleni uderu - Crush | E13: 5 | G13: Zrychleni uderu - Crush | H13: 5 | K13: Hazeni | L13: 10
A14: Zrychleni uderu - Sword | B14: 5 | D14: Zrychleni uderu - Sword | E14: 5 | G14: Zrychleni uderu - Sword | H14: 5 | K14: Probodnuti | L14: 20
A15: Smrst mece - uder | B15: 5 | D15: Smrst mece - uder | E15: 5 | G15: Drazdeni | H15: 5 | K15: Strelba zubatych sipek | L15: 20 | M15: 0.9
A16: Kick - snizeni CD | B16: 5 | D16: Smrst mece +15% dmg | E16: 5 | G16: Disarm - zkraceny CD | H16: 5 | K16: Vykryti stitem | L16: 20 | M16: 0.2
A18: Utok zezadu +10% dmg | B18: 5 | D18: Melee +10% dmg | E18: 5 | G18: Zvyseny uhyb +20% | H18: 5 | L18: =SUM(L4:L17) -> 260
A19: Provocation +25% | B19: 5 | D19: Poisoning efekt +25% | E19: 5 | G19: Zvyseny uhyb CD - 2 min | H19: 5
A20: Bowmastery +5% | B20: 5 | D20: Bowmastery +5% | E20: 5 | G20: Oslabeni +25% | H20: 5 | K20: SE
A21: Crushingmastery +5% | B21: 5 | D21: Crushingmastery 5% | E21: 5 | G21: Crushingmastery 5% | H21: 5 | K21: Abilita | L21: pocet bodu | M21: efekt
A22: Swordmastery +5% | B22: 5 | D22: Swordmastery +5% | E22: 5 | G22: Swordmastery +5% | H22: 5 | K22: Regenerace Many | L22: 10 | M22: 10 bodu/10sek
K23: Regenerace zivotu | L23: 10 | M23: 10 bodu/10sek
A24: Oslepeni | B24: 5 | D24: Haste | E24: 5 | G24: Proražení AR - uder | H24: 5 | K24: Regenerace Staminy | L24: 10 | M24: 10 bodu/10sek
A25: Oslepeni CD -10 sek | B25: 5 | D25: Haste - +5% | E25: 5 | G25: Proražení AR +10 sek | H25: 5 | K25: Uhnuti uderu | L25: 40 | M25: 0.4 | N25: upgrade na 60%
G26: Omráèení - šance | H26: 5 | K26: Absorbce | L26: 20 | M26: 0.2
G27: Omráèení - efekt | H27: 5 | K27: Sani HP | L27: 10 | M27: 10% z rány | N27: upgrade na 20%
K28: Sani Staminy | L28: 10 | M28: 10% z rány | N28: upgrade na 20%
K29: Sani many | L29: 10 | M29: 10% z rány | N29: upgrade na 20%
D30: Dvojity zasah - uder | E30: 5 | G30: Pain - zpomaleni utoku | H30: 5 | K30: Longrange | L30: 10
D31: Dvojity zasah +20% | E31: 5 | G31: Pain - efekt | H31: 5 | K31: Hazeni | L31: 10
A32: Probodnuti +15% dmg | B32: 5 | G32: Cleave/bounce - uder | H32: 5 | K32: Blokace stitem | L32: 10 | M32: 0.1 | N32: upgrade na 20%
A33: Longrange CD -30 sek | B33: 5 | G33: Cleave/bounce +25% | H33: 5 | K33: Kick | L33: 10
K34: Pretnuti slach | L34: 10
K35: Bleed | L35: 10
K36: Probodnuti | L36: 10
B37: =SUM(B4:B35) -> 95 | E37: =SUM(E4:E35) -> 95 | H37: =SUM(H4:H35) -> 125 | K37: Dmg za lvl | L37: 150 | M37: 1
L38: =SUM(L22:L37) -> 340
A41: counteratack
G42: tank
A43: stuny | D43: sani HP vetsi
A44: probodnuti | D44: doublswing | G44: snizeni AR
A45: utok zezadu | G45: zpomaleni utoku
A47: Poznamka: | B47: ceny abilit budou nakonec stanoveny v absolutnich hodnotach, nikoliv v %
A48: Talenty - Aktivni | B48: Popis
A49: Koncepce zpomaleni | B49: - jedno zpomaleni 5%-10% podle druhu - 1x druh zpomaleni = strop 20% - 2x druh zpomaleni = strop 25% + pomalejsi padani dolu - 3x druh zpomaleni = strop 35% + extra pomalejsi padani dolu | J49: Kouzlo - 10% zapomaleni/kouzlo Jed - 5% zapomaleni /uder Uder - 7% zapomaleni / uder
A50: Utok zezadu | B50: - Pasivni abilita - pokud je utocnik za monstrem, zpusobuje o 20% (30%) vetsi dmg.
A51: Odrazeni kouzla stitem | B51: - Aktivni abilita, aktivita zere staminu, aktivace sezere 1/4 max stamina, CD 7 min (2 upgr) - Nasledujici negativni kouzlo je na 80% odrazeno (ne zpet na utocnika) - pouze pokud je stit od aktivace po odrazeni kouzla nepretrzite v ruce (max ale 15 sek].
A52: Omraceni | B52: - Aktivni abilita, aktivita zere staminu (on/off), bez CD, jen kladiva - sance dle materialu (copper 5%, 10, 12, 15, 18, 21 a 25%), ze cil bude omracen (0,5-3s) - Paralyza pri dalsim zraneni monstra prolomena
A53: Disarm | B53: - aktivni abilita, CD 5 (2) min, sezere 1/2 maxstaminy - sance odzbrojit monstrum, pokud uziva zbran (+tesny kontakt) - monstrum 60 sekund nemuze zbran vzit (nebo klesne UC)
A54: Pain | B54: - aktivni ablitita, CD 2 minuty, pouze ostre zbrane - zapnuty talent spotrebovava staminu (on/off) - +/- 5% (dle materialu) pøi úderu na snižení kadence uderu monstra o 5(10)% na 20 sekund - dalsim uspechem se nescita efekt, pouze prodluzuje sance
A55: Zurivost | B55: - aktivni ablitita, CD 20 minut, nelze se stitem - zapnuti sezere 1/2 staminy, talent spotrebovava staminu (on/off). - dmg je zvednuto o 80% na dobu 20 sekund.
A56: Zvyseny uhyb | B56: - aktivni ablitita, CD 5 (2) minut - efekt pasivni ability vzroste o 20% - Req: 80 stamina, dosazeno maxima abilty
A57: Haste | B57: - aktivni ablitita, CD 10 minut - zapnuty talent spotrebovava staminu, pri stam = 0 se vypina - rychlost utoku vzroste o 10% (15) na dobu 20 sekund
A58: Longrange | B58: - aktivni abilita, CD 2 (1,5) minuty, sezere 1/2 maxstaminy, trva 10 sekund - Ranger/zlodej - prodluzuje dosah + 100% fizzuje kouzla - Warior - prodluzuje dosah leapu o 2 pole - Mystik - prodluzuje dosah + 100% fizzuje kouzla (dmg bez paralyzy)
A59: Posileni agra | B59: - pasivni abilita - kazdy uder zveda agro o 20% silneji
A60: Drazdeni | B60: - aktivni abilita, zere staminu (on/off) - po dobu trvani zapnuteho talentu je generovane agro +30%
A61: Zaujmuti monstra | B61: - aktivni abilita, CD 1 min, sezere 1/4 maxstaminy - sance ze monstrum bude nasledujicih 5 sekund utocit jen na tanka
A62: Challenging shout | B62: - aktivni abilita, CD 10 min, sezere 100% maxstaminy - vsechna monstra (I summoni?) v dosahu obrati pozornost na wariora - uspesnost zavisla na vzdalenosti
A63: Roar | B63: - aktivni abilita, CD 10 min, sezere 100% maxstaminy - monstra v dosahu se mohou vydesit (zmatene chodi a neutoci, delka dle uspechu) - uspesnost zavisla na vzdalenosti (a na uc? zbrani? Lvl?)
A64: Odrazeni uderu zpet na utocnika | B64: - aktivni abilita, CD 7 (2) min, 1/2 staminy, vyzaduje mastery - nasledujici 3 zasahy (max 5 sekund) ma warior 80% sanci odrazit uder zpet na utocnika - vyzaduje obranny postoj + vylucuje stit
A66: Talenty -Pasivni | B66: Popis
A67: Regenerace HP, SP a MP | B67: - pasivni abilita - 1x bod ability = 1 regenerovany bod za 10 sekund - talenty je mozny upgrade (1x abilita = 2 regenerovane body)
A68: Uhnuti uderu | B68: - pasivni abilita - sance, ze postava zcela uhne uderu (melee nebo archery) - ruzna povolani maji ruzny strop (20-40%)
A69: Absorbce kouzla | B69: - pasivni abilita - sance, ze postava zcela absorbuje magicke dmg - ruzna povolani maji ruzny strop (20-40%)
A70: Sani HP, MP a SP | B70: - pasivni abilita - sance, ze postava uderem, kouzlem vysaje prislusne body z monstra (20% z rany, ale zaroven I porovnovat se stropem pro sani) - talenty je mozny upgrade
A71: Hazeni | B71: - pasivni abilita - umoznuje hazet kudly a bomby
A72: Bonus za level - damage | B72: - pasivni abilita, PvM - lze od lvlu 50, maximalne pocet bodu = lvl - 50 - kazdy bod zvedne o 0,5% PvM dmg, u kouzlivcu pres standcast.
A73: Blokace stitem | B73: - Pasivni abilita pokud je equipnut stit - 10x body v abilite ---> sance 10% (20%) snizit PvM dmg o procentni cast dle materialu (Copper shield - 15, 20, 25, 30, 35, 40 a 50%)
A74: Enrage | B74: - pasivni abilita, vylucuje stit a obranny postoj - pri poklesu HP pod 5% je 10% sance, ze valecnik zacne besnit. - PvM dmg boost 20% na 10 vterin
A76: Udery - pristi rana | B76: Popis
A77: Bleeding (i PvP) | B77: - pristi uder = Zasadi cili Bleed - bez CD, 100% uspech - Req: 40 stamina, ostra zbran
A78: Kick (i PvP) | B78: - Pristi uder = 20% normal dmg + 100% sance prerusit cili kouzlo nebo uder. - CD - 2 (1) minuty - Req: sezere 80 staminy
A79: Disarm (jen PvM) | B79: - Pristi uder = 95% sance na odzbrojeni monstra - pokud uziva zbran (+tesny kontakt) - monstrum 60 sekund nemuze zbran vzit (nebo klesne UC)
A80: Pretnuti slach (jen PvM) | B80: - pristi uder = 20% normal dmg + zpomaleni monstra o 7%, stackovatelne az do stropu - bez CD, delka zpomaleni se kazdym dalsim zasazeni restartuje. - Req: 40 stamina, ostra zbran
A81: Doubleswing (jen PvM) | B81: - Pristi uder = +50% (60%) zraneni - CD: 15 sek - Req: 80 stamina, obourucna sekera
A82: Ochromeni (jen PvM) | B82: - Pristi uder = cil paralyzovan na 10 sekund (kazdy dmg prolomi ochromeni) - CD 20 minut, (sance dle UC a AR cile, ale vysoka) - Req: 120 stamina, kladiva a polearms - 1+2hand
A83: Vampiric hit (jen PvM) | B83: - Pristi uder = nezrani, ale 40% (50%) zakladni rany je prevedeno do HP valecnika - CD 10 minut - Req: 120 stamina, mece ci sekery - 1+2hand
A84: Smrst mece (jen PvM) | B84: - Pristi uder = 60% (75%) normalniho uderu zasahne vse v okoli zlodeje (8 poli) - CD 2 minuty, 90% uspech - Req: 75 stamina, sword
A85: Devastate (jen PvM) | B85: - Pristi uder = +60 (80%) zraneni - CD: 20 sek - Req: 100 stamina, obourucna polearm
A86: Oslepeni (jen PvM) | B86: - Pristi uder = 20% normal dmg + oslepeni monstra (2 sek) - CD: 30 (20) sek - Req: 65 stamina
A87: Prorazeni AR (jen PvM) | B87: - Pristi uder = sance na snizeni armoru cile o 5% na 20 (30) sekund - CD: 10 sek, (sance dle UC a AR cile) - Req: 50 stamina, Kladiva - 1+2hand
A88: Cleave/Bounce (jen PvM) | B88: - Pristi uder = 80% sance zasahnout druhy cil v tesne blizkosti zlodeje za 60% (75%) dmg - bez CD - Req: sezere 80 staminy, zbran