A2: Protection warior | D2: Axes/ Swords | G2: Hammers/Polearms
K3: Abilita | L3: pocet bodu | M3: efekt
A4: Obranny postoj | B4: 5 | D4: Leap | E4: 5 | G4: Warcry | H4: 5 | K4: Regenerace Many | L4: 20 | M4: 20 bodu/10sek
A5: Zkraceni CD OP | B5: 5 | D5: Zkraceni CD Leapu | E5: 5 | G5: Zkraceni CD warcry | H5: 5 | K5: Regenerace zivotu | L5: 20 | M5: 20 bodu/10sek
A6: Blokace stitem +10% | B6: 5 | D6: Saní SP +10% | E6: 5 | G6: WC - efekt silence | H6: 5 | K6: Regenerace Staminy | L6: 20 | M6: 20 bodu/10sek
A7: Regenerace HP +10 | B7: 5 | D7: Regenerace SP +10 | E7: 5 | G7: Regenerace MP +10 | H7: 5 | K7: Uhnuti uderu | L7: 30 | M7: 0.3
A8: Drazdeni +30% agro | B8: 5 | D8: Smash +25% dmg | E8: 5 | G8: Sani HP +10% | H8: 5 | K8: Absorbce | L8: 20 | M8: 0.2
A9: Zaujmuti monstra | B9: 5 | D9: Challenging shout | E9: 5 | G9: Melee +10% dmg | H9: 5 | K9: Sani HP | L9: 20
A10: Prvni stupen (bile) dostupny vsem vetvim, od druheho pouze pro danou vetev a specializaci | K10: Sani Staminy | L10: 20
A11: + 15%dmg 1H sword | B11: 5 | D11: +15% dmg Axe | E11: 5 | G11: +15% dmg crush | H11: 5 | K11: Sani many | L11: 20
A12: + 15%dmg 1H axe | B12: 5 | D12: +15% smg Sword | E12: 5 | G12: +15% dmg Pole | H12: 5 | K12: Longrange | L12: 10
A13: + 15%dmg 1H crush | B13: 5 | D13: Zrychleni uderu - Axe | E13: 5 | G13: Zrychleni uderu - Crush | H13: 5 | K13: Hazeni | L13: 10
A14: Sání HP +10% | B14: 5 | D14: Zrychleni uderu - Sword | E14: 5 | G14: Zrychleni uderu - polearms | H14: 5 | K14: warcry | L14: 10 | M14: 0.95
A15: Zrychleni uderu - Axe | B15: 5 | D15: Piercing +5% - Axe | E15: 5 | G15: Piercing +5% - crush | H15: 5 | K15: Leap | L15: 10 | M15: 0.95
A16: Zrychleni uderu - Sword | B16: 5 | D16: Piercing +5% - sword | E16: 5 | G16: Piercing +5% - polearms | H16: 5 | K16: Vykryti stitem | L16: 20 | M16: 0.2
K17: Omracujici uder | L17: 10 | M17: 0.3
A18: Odrazeni kouzla stit. | B18: 5 | D18: Saní staminy +5% | E18: 5 | G18: Saní staminy +5% | H18: 5 | K18: Round | L18: 10 | M18: 0.9
A19: + zkraceni CD | B19: 5 | D19: Axe mastery +5% skill | E19: 5 | G19: Crush mastery +5% skill | H19: 5 | K19: Dvojity zasah | L19: 20
A20: Axe mastery +5% skill | B20: 5 | D20: Sword mastery +5% skill | E20: 5 | G20: Pole mastery +5% skill | H20: 5 | K20: Obrany postoj | L20: 10
A21: Sword mastery +5% skill | B21: 5 | D21: Pain - zpomaleni utoku | E21: 5 | G21: Omráèení - šance | H21: 5
A22: Crush mastery +5% skill | B22: 5 | D22: Pain - efekt | E22: 5 | G22: Omráèení - efekt | H22: 5 | L22: =SUM(L4:L21) -> 280
K23: SE
A24: Omráèení - šance | B24: 5 | D24: Posilení Round +20% | E24: 5 | G24: Posilení Round +20% | H24: 5 | K24: Abilita | L24: pocet bodu | M24: efekt | N24: Talenty
A25: Omráèení - efekt | B25: 5 | D25: +15% dmg Axe | E25: 5 | G25: Enrage | H25: 5
A26: Odrazeni uderu zpet | B26: 5 | D26: +15% smg Sword | E26: 5 | G26: +15% dmg crush | H26: 5 | K26: Regenerace Many | L26: 10 | M26: 10 bodu/10sek | N26: upgrade na 20
A27: + zkraceni CD | B27: 5 | D27: Vampiric hit - uder | E27: 5 | G27: +15% dmg Polearms | H27: 5 | K27: Regenerace zivotu | L27: 10 | M27: 10 bodu/10sek | N27: upgrade na 20
A28: Posileni agra +20% | B28: 5 | D28: Vampiric hit +25% | E28: 5 | G28: Roar | H28: 5 | K28: Regenerace Staminy | L28: 10 | M28: 10 bodu/10sek | N28: upgrade na 20
K29: Uhnuti uderu | L29: 30 | M29: 0.3
A30: Vykrytí štítem + 5% | B30: 5 | D30: Dvojity zasah - uder | E30: 5 | G30: Proražení AR - uder | H30: 5 | K30: Absorbce | L30: 20 | M30: 0.2
A31: Tvrdost - AR +20% | B31: 5 | D31: Dvojity zasah +20% | E31: 5 | G31: Proražení AR +50% doba | H31: 5 | K31: Sani HP | L31: 10 | M31: 10% z rány | N31: upgrade na 20%
A32: Cleave/bounce - uder | B32: 5 | D32: Pøesný zásah - uder | E32: 5 | G32: Devastate - uder | H32: 5 | K32: Sani Staminy | L32: 10 | M32: 10% z rány | N32: upgrade na 20%
A33: Cleave/bounce +25% | B33: 5 | D33: Pøesný zásah +25% | E33: 5 | G33: Devastate +25% | H33: 5 | K33: Sani many | L33: 10 | M33: 10% z rány | N33: upgrade na 20%
K34: Longrange | L34: 10
A35: Shield wall | B35: 1 | D35: Zuøivost | E35: 1 | G35: Ochromeni - uder | H35: 1 | K35: Hazeni | L35: 10
K36: Blokace stitem | L36: 10 | M36: 0.1
G37: polearm (hala, Bardiche, kopi) | K37: Smash - uder | L37: 10 | M37: 0.95
G38: Crush (hammers, hole) | K38: Roundatack - uder | L38: 10 | M38: 0.9
B39: =SUM(B4:B37) -> 131 | E39: =SUM(E4:E37) -> 131 | H39: =SUM(H4:H37) -> 131 | K39: Pretnuti slach - uder | L39: 10 | M39: 0.95
K40: Dmg za lvl - PvM | L40: 150 | M40: 1
A41: Poznamka: | B41: ceny abilit budou nakonec stanoveny v absolutnich hodnotach, nikoliv v % | L41: =SUM(L26:L40) -> 320
A42: Talenty | B42: Popis
A43: Obranny postoj | B43: - Aktivni abilita, aktivace sezere 1/4 max stamina, CD 5 min - Veskery dmg obdrzeny wariorem v PvM je redukovan o 15% - Veskery dmg udileny wariorem v PvM je redukovan o 30%
A44: Odrazeni kouzla stitem | B44: - Aktivni abilita, aktivita zere staminu, aktivace sezere 1/4 max stamina, CD 7 min (2 upgr) - Nasledujici negativni kouzlo je na 80% odrazeno (ne zpet na utocnika) - pouze pokud je stit od aktivace po odrazeni kouzla nepretrzite v ruce.
A45: Omraceni | B45: - Aktivni abilita, aktivita zere staminu (on/off), bez CD, jen kladiva - sance dle materialu (copper 5%, 10, 12, 15, 18, 21 a 25%), ze cil bude omracen (0,5-3s) - Paralyza pri dalsim zraneni monstra prolomena
A46: Blokace stitem | B46: - Pasivni abilita pokud je equipnut stit - 10x body v abilite ---> sance 20% (25%) snizit PvM dmg o procentni cast dle materialu (Copper shield - 15, 20, 25, 30, 35, 40 a 50%)
A47: Shield wall | B47: - aktivni ablitita, CD 20 minut - zapnuti sezere 1/2 staminy, talent spotrebovava staminu. - blokace stítem na 20 sekund u každé melee a archery rány (tedy zavisle na materialu)
A48: Pain | B48: - aktivni ablitita, CD 2 minuty, pouze sekery a mece - zapnuty talent spotrebovava staminu (on/off) - +/- 5% (dle materialu) pøi úderu na snižení kadence uderu monstra o 5(10)% na 20 sekund - dalsim uspechem se nescita efekt, pouze prodluzuje sance
A49: Zurivost | B49: - aktivni ablitita, CD 20 minut, nelze se stitem - zapnuti sezere 1/2 staminy, talent spotrebovava staminu (on/off). - dmg je zvednuto o 80% na dobu 20 sekund.
A50: Warcry | B50: - aktivni ablitita, CD 5 minut (upgrade) - zapnuti sezere 20 many - zrusi vsem v dosahu kouzlo (upgdrade se projevi silencem v PvM na 3 sek)
A51: Prorazeni AR | B51: - aktivni ablitita, CD 2 minuty, pouze kladiva a polearms - zapnuty talent spotrebovava staminu (on/off) - +/- 5% (dle materialu) sance pøi úderu na snižení armoru monstra o 5% na 20 sekund - dalsim uspechem se nescita efekt, pouze prodluzuje sance
A52: Regenerace HP, SP a MP | B52: - pasivni abilita - 1x bod ability = 1 regenerovany bod za 10 sekund - talenty je mozny upgrade (1x abilita = 2 regenerovane body)
A53: Uhnuti uderu | B53: - pasivni abilita - sance, ze postava zcela uhne uderu (melee nebo archery) - ruzna povolani maji ruzny strop (20-40%)
A54: Absorbce kouzla | B54: - pasivni abilita - sance, ze postava zcela absorbuje magicke dmg - ruzna povolani maji ruzny strop (20-40%)
A55: Sani HP, MP a SP | B55: - pasivni abilita - sance, ze postava uderem, kouzlem vysaje prislusne body z monstra (20% z rany, ale zaroven I porovnovat se stropem pro sani) - talenty je mozny upgrade
A56: Longrange | B56: - aktivni abilita, CD 2 minuty, sezere 1/2 maxstaminy, trva 10 sekund - Ranger/zlodej - prodluzuje dosah + 100% fizzuje kouzla - Warior - prodluzuje dosah leapu o 2 pole - Mystik - prodluzuje dosah + 100% fizzuje kouzla (dmg bez paralyzy)
A57: Hazeni | B57: - pasivni abilita - umoznuje hazet kudly a bomby
A58: Bonus za level - damage | B58: - pasivni abilita, PvM - lze od lvlu 50, maximalne pocet bodu = lvl - 50 - kazdy bod zvedne o 0,5% PvM dmg, u kouzlivcu pres standcast.
A59: Koncepce zpomaleni | B59: - jedno zpomaleni 5%-10% podle druhu - 1x druh zpomaleni = strop 20% - 2x druh zpomaleni = strop 25% + pomalejsi padani dolu - 3x druh zpomaleni = strop 35% + extra pomalejsi padani dolu
A60: Posileni agra | B60: - pasivni abilita - kazdy uder zveda agro o 20% silneji
A61: Drazdeni | B61: - aktivni abilita, zere staminu (on/off) - po dobu trvani zapnuteho talentu je generovane agro +30%
A62: Zaujmuti monstra | B62: - aktivni abilita, CD 1 min, sezere 1/4 maxstaminy - sance ze monstrum bude nasledujicih 5 sekund utocit jen na tanka
A63: Challenging shout | B63: - aktivni abilita, CD 10 min, sezere 100% maxstaminy - vsechna monstra (I summoni?) v dosahu obrati pozornost na wariora - uspesnost zavisla na vzdalenosti
A64: Disarm ---> zlodej | B64: - aktivni abilita, CD 5 min, sezere 1/2 maxstaminy - sance odzbrojit monstrum, pokud uziva zbran (+tesny kontakt) - monstrum 60 sekund nemuze zbran vzit (nebo klesne UC)
A65: Enrage | B65: - pasivni abilita, vylucuje stit a obranny postoj - pri poklesu HP pod 5% je 10% sance, ze valecnik zacne besnit. - PvM dmg boost 20% na 10 vterin
A66: Roar | B66: - aktivni abilita, CD 10 min, sezere 100% maxstaminy - monstra v dosahu se mohou vydesit (zmatene chodi a neutoci, delka dle uspechu) - uspesnost zavisla na vzdalenosti (a na uc? zbrani? Lvl?)
A67: Odrazeni uderu zpet na utocnika | B67: - aktivni abilita, CD 7 (2) min, 1/2 staminy, vyzaduje mastery - nasledujici 3 zasahy (max 5 sekund) ma warior 80% sanci odrazit uder zpet na utocnika - vyzaduje obranny postoj + vylucuje stit
A68: Ochromeni | B68: - okamzity uder, cil paralyzovan na 10 sekund (kazdy dmg prolomi ochromeni) - CD 20 minut, (sance dle UC a AR cile, ale vysoka) - Req: 120 stamina, kladiva a polearms - 1+2hand
A69: Vampiric hit | B69: - okamzity uder = nezrani, ale 40% (50%) zakladni rany je prevedeno do HP valecnika - CD 10 minut - Req: 120 stamina, mece ci sekery - 1+2hand
A70: Roundatack (i PvP) | B70: - okamzity uder = 60% (75%) normalniho uderu zasahne vse v okoli wariora (8 poli) - CD 2 minuty, 90% uspech - Req: 75 stamina, 2hand zbran
A72: Udery | B72: Popis
A73: Pretnuti slach | B73: - pristi uder = zpomaleni monstra o 7%, stackovatelne az do stropu zpomaleni - bez CD, 95% uspech, timer nastavuje na delku posledniho zasazeni - Req: 40 stamina, ostra zbran
A74: Smash (i PvP) | B74: - pristi uder = posilen o 16% (20%) - bez CD, 95% uspech - Req: 100 stamina, zbran i unarmed
A75: Doubleswing | B75: - Pristi uder = +50% (60%) zraneni - CD: 15 sek - Req: 80 stamina, obourucna sekera
A76: Devastate | B76: - Pristi uder = +60 (80%) zraneni - CD: 20 sek - Req: 100 stamina, obourucna polearm
A77: Presny zasah | B77: - Pristi uder = +40% (50%) zraneni - CD: 12 sek - Req: 65 stamina, mec - 1+2hand
A78: Prorazeni AR | B78: - Pristi uder = sance na snizeni armoru cile o 5% na 20 (30) sekund - CD: 10 sek, (sance dle UC a AR cile) - Req: 50 stamina, Kladiva - 1+2hand
A79: Cleave/Bounce | B79: - Pristi uder = 80% sance zasahnout druhy cil v tesne blizkosti wariora za 60% (75%) dmg - bez CD - Req: sezere 80 staminy, zbran - 1+2hand, nelze kladivy