A2: Protection warior | D2: Axes/ Swords | G2: Hammers/Polearms
K3: Abilita | L3: pocet bodu | M3: efekt
A4: Obranny postoj | B4: 5 | D4: Leap | E4: 5 | G4: Warcry | H4: 5 | K4: Regenerace Many | L4: 20 | M4: 20 bodu/10sek
A5: Zkraceni CD OP | B5: 5 | D5: Zkraceni CD Leapu | E5: 5 | G5: Zkraceni CD warcry | H5: 5 | K5: Regenerace zivotu | L5: 20 | M5: 20 bodu/10sek
A6: Blokace stitem +10% | B6: 5 | D6: Saní SP +10% | E6: 5 | G6: WC - efekt silence | H6: 5 | K6: Regenerace Staminy | L6: 20 | M6: 20 bodu/10sek
A7: Regenerace HP +10 | B7: 5 | D7: Regenerace SP +10 | E7: 5 | G7: Regenerace MP +10 | H7: 5 | K7: Uhnuti uderu | L7: 30 | M7: 0.3
A8: Drazdeni +30% agro | B8: 5 | D8: Pretnuti slach | E8: 5 | G8: Sani HP +10% | H8: 5 | K8: Absorbce | L8: 20 | M8: 0.2
A9: Zaujmuti monstra | B9: 5 | D9: Challenging shout | E9: 5 | G9: Melee +10% dmg | H9: 5 | K9: Sani HP | L9: 20
A10: Prvni stupen (bile) dostupny vsem vetvim, od druheho pouze pro danou vetev a specializaci | K10: Sani Staminy | L10: 20
A11: + 15%dmg 1H sword | B11: 5 | D11: +15% dmg Axe | E11: 5 | G11: +15% dmg crush | H11: 5 | K11: Sani many | L11: 20
A12: + 15%dmg 1H axe | B12: 5 | D12: +15% smg Sword | E12: 5 | G12: +15% dmg Pole | H12: 5 | K12: Longrange | L12: 10
A13: + 15%dmg 1H crush | B13: 5 | D13: Zrychleni uderu - Axe | E13: 5 | G13: Zrychleni uderu - Crush | H13: 5 | K13: Hazeni | L13: 10
A14: Sání HP +10% | B14: 5 | D14: Zrychleni uderu - Sword | E14: 5 | G14: Zrychleni uderu - polearms | H14: 5 | K14: warcry | L14: 10 | M14: 0.95
A15: Zrychleni uderu - Axe | B15: 5 | D15: Piercing +5% - Axe | E15: 5 | G15: Piercing +5% - crush | H15: 5 | K15: Leap | L15: 10 | M15: 0.95
A16: Zrychleni uderu - Sword | B16: 5 | D16: Piercing +5% - sword | E16: 5 | G16: Piercing +5% - polearms | H16: 5 | K16: Vykryti stitem | L16: 20 | M16: 0.2
K17: Omracujici uder | L17: 10 | M17: 0.3
A18: Odrazeni kouzla stit. | B18: 5 | D18: Saní staminy +5% | E18: 5 | G18: Saní staminy +5% | H18: 5 | K18: Round | L18: 10 | M18: 0.9
A19: + zkraceni CD | B19: 5 | D19: Axe mastery +5% skill | E19: 5 | G19: Crush mastery +5% skill | H19: 5 | K19: Dvojity zasah | L19: 20
A20: Axe mastery +5% skill | B20: 5 | D20: Sword mastery +5% skill | E20: 5 | G20: Pole mastery +5% skill | H20: 5 | K20: Obrany postoj | L20: 10
A21: Sword mastery +5% skill | B21: 5 | D21: Pain - zpomaleni utoku | E21: 5 | G21: Šance na proražení AR | H21: 5
A22: Crush mastery +5% skill | B22: 5 | D22: Pain - efekt | E22: 5 | G22: Efekt proražení AR | H22: 5
L23: =SUM(L4:L22) -> 280
A24: Omráèení - šance | B24: 5 | D24: Posilení Round +20% | E24: 5 | G24: Posilení Round +20% | H24: 5
A25: Odrazeni uderu zpet | B25: 5 | D25: +15% dmg Axe | E25: 5 | G25: +15% dmg crush | H25: 5 | K25: SE
A26: + zkraceni CD | B26: 5 | D26: +15% smg Sword | E26: 5 | G26: +15% dmg Polearms | H26: 5
A27: Cleave/bounce | B27: 5 | D27: Vampyric hit | E27: 5 | G27: Roar | H27: 5 | K27: Abilita | L27: pocet bodu | M27: efekt | N27: Talenty
K28: Regenerace Many | L28: 10 | M28: 10 bodu/10sek
A29: Vykrytí štítem + 5% | B29: 5 | D29: Dvojity zasah - šance | E29: 5 | G29: Omráèení - šance | H29: 5 | K29: Regenerace zivotu | L29: 10 | M29: 10 bodu/10sek | N29: +update na 20
A30: Tvrdost - AR +20% | B30: 5 | D30: Pøesný zásah - šance | E30: 5 | G30: Devastate - polearms | H30: 5 | K30: Regenerace Staminy | L30: 10 | M30: 10 bodu/10sek | N30: +update na 20
A31: Posileni agra +20% | B31: 5 | D31: Disarm - PvM | E31: 5 | G31: Enrage | H31: 5 | K31: Uhnuti uderu | L31: 30 | M31: 0.3
K32: Absorbce | L32: 20 | M32: 0.2
A33: Shield wall | B33: 1 | D33: Zuøivost | E33: 1 | G33: Ochromeni - instantní | H33: 1 | K33: Sani HP | L33: 20 | M33: 20% z rány | N33: +update na 30%
K34: Sani Staminy | L34: 20 | M34: 20% z rány | N34: +update na 30%
G35: polearm (hala, Bardiche, kopi) | K35: Sani many | L35: 20 | M35: 20% z rány
G36: Crush (hammers, hole) | K36: Longrange | L36: 10
B37: =SUM(B4:B35) -> 121 | E37: =SUM(E4:E35) -> 121 | H37: =SUM(H4:H35) -> 121 | K37: Hazeni | L37: 10
K38: Round | L38: 10 | M38: 0.9 | N38: + update dmg
A39: Poznamka: | B39: ceny abilit budou nakonec stanoveny v absolutnich hodnotach, nikoliv v % | K39: Blokace stitem | L39: 10 | M39: 0.1 | N39: +update na 25%
A40: Talenty | B40: Popis
A41: Obranny postoj | B41: - Aktivni abilita, aktivita zere staminu, aktivace sezere 1/4 max stamina, CD 5 min - Veskery dmg obdrzeny wariorem v PvM je redukovan o 15% - Veskery dmg udileny wariorem v PvM je redukovan o 30% | K41: Dmg za lvl - PvM | L41: 150 | M41: 1
A42: Odrazeni kouzla stitem | B42: - Aktivni abilita, aktivita zere staminu, aktivace sezere 1/4 max stamina, CD 7 min (2 upgr) - Nasledujici negativni kouzlo je na 80% odrazeno (ne zpet na utocnika) - pouze pokud je stit od aktivace po odrazeni kouzla nepretrzite v ruce. | L42: =SUM(L28:L41) -> 330
A43: Omraceni | B43: - Aktivni abilita, aktivita zere staminu, bez CD, jen kladiva - sance dle materialu (copper 5%, 10, 12, 15, 18, 21 a 25%), ze cil bude omracen (3s) - Paralyza pri dalsim zraneni monstra prolomena
A44: Blokace stitem | B44: - Pasivni abilita pokud je equipnut stit - 10x body v abilite ---> sance 20% (25%) snizit PvM dmg o procentni cast dle materialu (Copper shield - 15, 20, 25, 30, 35, 40 a 50%)
A45: Shield wall | B45: - aktivni ablitita, CD 20 minut - zapnuti sezere 1/2 staminy, talent spotrebovava staminu. - blokace stítem na 20 sekund u každé melee a archery rány (tedy zavisle na materialu)
A46: Pain | B46: - aktivni ablitita, CD 2 minuty, pouze sekery a mece - zapnuty talent spotrebovava staminu - +/- 5% (dle materialu) pøi úderu na snižení kadence uderu monstra o 10% na 20 sekund - dalsim uspechem se nescita efekt, pouze prodluzuje sance
A47: Doubleswing | B47: - aktivni ablitita, CD 2 minuty, pouze u Seker - zapnuty talent spotrebovava staminu, pri nedostatku staminy se automaticky vypina. - 15% sance, ze bude zasazena druha rana (+80%)
A48: Presny zasah | B48: - aktivni ablitita, CD 2 minuty - zapnuty talent spotrebovava staminu, pri nedostatku staminy se automaticky vypina. - 20% sance, ze bude zasazena presna rana (+60%)
A49: Zurivost | B49: - aktivni ablitita, CD 20 minut, nelze se stitem - zapnuti sezere 1/2 staminy, talent spotrebovava staminu. - dmg je zvednuto o 80% na dobu 20 sekund.
A50: Warcry | B50: - aktivni ablitita, CD 5 minut (upgrade) - zapnuti sezere 20 many - zrusi vsem v dosahu kouzlo (upgdrade se projevi silencem v PvM na 3 sek)
A51: Prorazeni AR | B51: - aktivni ablitita, CD 2 minuty, pouze kladiva a polearms - zapnuty talent spotrebovava staminu - +/- 5% (dle materialu) sance pøi úderu na snižení armoru monstra o 5% na 20 sekund - dalsim uspechem se nescita efekt, pouze prodluzuje sance
A52: Devastate | B52: - aktivni ablitita, CD 2 minuty, pouze polearms - zapnuty talent spotrebovava staminu - kazda rana zvednuta o 10%
A53: Ochromeni | B53: - aktivni ablitita, CD 20 minut, jen kladiva a polearms - zapnuti sezere 1/2 staminy, talent spotrebovava staminu. - cil 100% paralyzovan na 10 sekund (kazdy dmg prolomi ochromeni)
A54: Regenerace HP, SP a MP | B54: - pasivni abilita - 1x bod ability = 1 regenerovany bod za 10 sekund - talenty je mozny upgrade (1x abilita = 2 regenerovane body)
A55: Uhnuti uderu | B55: - pasivni abilita - sance, ze postava zcela uhne uderu (melee nebo archery) - ruzna povolani maji ruzny strop (20-40%)
A56: Absorbce kouzla | B56: - pasivni abilita - sance, ze postava zcela absorbuje magicke dmg - ruzna povolani maji ruzny strop (20-40%)
A57: Sani HP, MP a SP | B57: - pasivni abilita - sance, ze postava uderem, kouzlem vysaje prislusne body z monstra (20% z rany, ale zaroven I porovnovat se stropem pro sani) - talenty je mozny upgrade
A58: Longrange | B58: - aktivni abilita, CD 2 minuty, sezere 1/2 maxstaminy, trva 10 sekund - Ranger/zlodej - prodluzuje dosah + 100% fizzuje kouzla - Warior - prodluzuje dosah leapu o 2 pole - Mystik - prodluzuje dosah + 100% fizzuje kouzla (dmg bez paralyzy)
A59: Hazeni | B59: - pasivni abilita - umoznuje hazet kudly a bomby
A60: Roundatack | B60: - aktivni abilita, CD 2 min, sezere 1/2 maxstaminy - umoznuje zasahnout vsehcno v okoli wariora (8 poli), 60% bezne rany - mozno upgradnout pres talent - pouze 2hand zbrane
A61: Bonus za level - damage | B61: - pasivni abilita, PvM - lze od lvlu 50, maximalne pocet bodu = lvl - 50 - kazdy bod zvedne o 0,5% PvM dmg, u kouzlivcu pres standcast.
A62: Pretnuti slach | B62: - aktivni abilita, CD 2 min, sezere 1/3 maxstaminy - sance zpomalit monstrum o 7%, vyzaduje ostrou zbran - monstrum muze odolat a nelze zpomalit napr. spiritu - pri dalsim uspechu se efekt scita a timer nastavuje na delku posledniho zasazeni
A63: Koncepce zpomaleni | B63: - jedno zpomaleni 5%-10% podle druhu - 1x druh zpomaleni = strop 20% - 2x druh zpomaleni = strop 30% + pomalejsi padani dolu - 3x druh zpomaleni = strop 35% + extra pomalejsi padani dolu
A64: Posileni agra | B64: - pasivni abilita - kazdy uder zveda agro o 20% silneji
A65: Drazdeni | B65: - aktivni abilita, zere staminu - po dobu trvani zapnuteho talentu je generovane agro +30%
A66: Zaujmuti monstra | B66: - aktivni abilita, CD 1 min, sezere 1/4 maxstaminy - sance ze monstrum bude nasledujicih 5 sekund utocit jen na tanka
A67: Challenging shout | B67: - aktivni abilita, CD 10 min, sezere 100% maxstaminy - vsechna monstra (I summoni?) v dosahu obrati pozornost na wariora - uspesnost zavisla na vzdalenosti
A68: Disarm | B68: - aktivni abilita, CD 5 min, sezere 1/2 maxstaminy - sance odzbrojit monstrum, pokud uziva zbran (+tesny kontakt) - monstrum 60 sekund nemuze zbran vzit (nebo klesne UC)
A69: Enrage | B69: - pasivni abilita, vylucuje stit a obranny postoj - pri poklesu HP pod 5% je 10% sance, ze valecnik zacne besnit. - PvM dmg boost 20% na 10 vterin
A70: Roar | B70: - aktivni abilita, CD 10 min, sezere 100% maxstaminy - monstra v dosahu se mohou vydesit (zmatene chodi a neutoci, delka dle uspechu) - uspesnost zavisla na vzdalenosti (a na uc? zbrani? Lvl?)
A71: Vampyric hit | B71: - aktivni abilita, CD 10 min, sezere 50% maxstaminy - rana nezrani monstrum, ale +/-50% zakladni rany je prevedeno do HP valecnika
A72: Odrazeni uderu zpet na utocnika | B72: - aktivni abilita, CD 7 (2) min, 1/2 staminy, vyzaduje mastery - nasledujici 3 zasahy (max 5 sekund) ma warior 80% sanci odrazit uder zpet na utocnika - vyzaduje obranny postoj + vylucuje stit
A73: Cleave/Bounce | B73: - aktivni abilita, bez CD, sezere 1/4 maxstaminy, nelze kladivy - umoznuje zasahnout druhy cil v tesne blizkosti wariora - 80% bezne rany, nelze v obranne pozici