A2: Lecitel/ Healer | D2: Zealot | G2: Paladin | K2: Stavající stav
K3: Abilita | L3: pocet bodu | M3: efekt
A4: Regenerace SP +10 | B4: 5 | D4: Regenerace MP +10 | E4: 5 | G4: Regenerace HP +10 | H4: 5 | K4: Regenerace Many | L4: 20 | M4: 20 bodu/10sek
A5: Bandage -20% delay | B5: 5 | D5: Protection +20% AR | E5: 5 | G5: Saní SP +10% | H5: 5 | K5: Regenerace zivotu | L5: 20 | M5: 20 bodu/10sek
A6: Agro -15% | B6: 5 | D6: Mana do hole +40% | E6: 5 | G6: Nosnost +20% | H6: 5 | K6: Regenerace Staminy | L6: 20 | M6: 20 bodu/10sek
A7: Unava/ vycerpani | B7: 5 | D7: Meditace +50% mana | E7: 5 | G7: Armor of Faith | H7: 5 | K7: Uhnuti uderu | L7: 30 | M7: 0.3
A8: Selfress +HP 50% | B8: 5 | D8: Selfress +MP 50% | E8: 5 | G8: Selfress +SP 50% | H8: 5 | K8: Absorbce | L8: 30 | M8: 0.3
A9: Bless +20% efekt | B9: 5 | D9: Implosion +25% dmg | E9: 5 | G9: Crushing +15%dmg | H9: 5
A10: + ucenlivost +10% Alch | B10: 5 | D10: + ucenlivost +10% Inscr | E10: 5 | G10: Zaujmuti monstra | H10: 5 | K10: Sani HP | L10: 20
A11: Prvni stupen (bile) dostupny vsem vetvim, od druheho pouze pro danou vetev a specializaci | K11: Sani Staminy | L11: 20
A12: Bandage -20% delay | B12: 5 | D12: Sani MP +10% | E12: 5 | G12: Sani HP +10% | H12: 5 | K12: Sani many | L12: 20
A13: Bandage -15% stamina | B13: 5 | D13: Heal +50% efekt | E13: 5 | G13: Drazdeni +30% agro | H13: 5 | K13: Longrange | L13: 10
A14: Peace mastery +10% | B14: 5 | D14: Heal -35% mana | E14: 5 | G14: AoF -25% mana | H14: 5 | K14: Hazeni | L14: 10
A15: Crushing +15%dmg | B15: 5 | D15: Lightning | E15: 5 | G15: AoF - +25% AR | H15: 5 | K15: Vykryti stitem | L15: 20 | M15: 0.2
A16: Boosty +20% vydrz | B16: 5 | D16: Lightning -40% mana | E16: 5 | G16: Crushing +15%dmg | H16: 5 | K16: Omracujici uder | L16: 10 | M16: 0.3
A17: Selfress +HP 50% | B17: 5 | D17: Selfress +MP 50% | E17: 5 | G17: Selfress +SP 50% | H17: 5 | K17: Selfress | L17: 10 | M17: 0.9
K18: Selfress - HP | L18: 20 | M18: 1
A19: Oziveni bandy -25% band. | B19: 5 | D19: Mass Heal +30% efekt | E19: 5 | G19: Roundatack | H19: 5 | K19: Selfress - MP | L19: 20 | M19: 1
A20: Healing mastery +5% | B20: 5 | D20: Lightning +25% dmg | E20: 5 | G20: Posilení Round +20% | H20: 5 | K20: Selfress - SP | L20: 20 | M20: 1
A21: AoF - +25% AR | B21: 5 | D21: Zvysena reg. many - aktiv. | E21: 5 | G21: Šance na proražení AR | H21: 5
A22: AoF -25% mana | B22: 5 | D22: +zkraceni CD -10min | E22: 5 | G22: Efekt proražení AR | H22: 5
A23: Vitality +25% VIT | B23: 5 | D23: Cunning +25% INT | E23: 5 | G23: Strenght +25% STR | H23: 5
L24: =SUM(L4:L23) -> 300
A25: Magery mastery +5% | B25: 5 | D25: Magery mastery +10% | E25: 5 | G25: Crushing mastery +25% | H25: 5
A26: Bandage -20% delay | B26: 5 | D26: Silence - lightning | E26: 5 | G26: Omráèení - šance | H26: 5
A27: Health Recovery | B27: 5 | D27: Silence - efekt 10% | E27: 5 | G27: Roar | H27: 5 | K27: SE
A28: Resurrection -20%mana | B28: 5 | D28: Resurrection -20%mana | E28: 5 | G28: AoF - +25% AR | H28: 5 | K28: Abilita | L28: pocet bodu | M28: efekt
A29: Agro -15% | B29: 5 | D29: Air skola +15% dmg | E29: 5 | G29: Agro -15% | H29: 5 | K29: Regenerace Many | L29: 10 | M29: 10 bodu/10sek
K30: Regenerace zivotu | L30: 10 | M30: 10 bodu/10sek
A31: Holy protection | B31: 5 | D31: Holy infusion | E31: 5 | G31: Holy weapon | H31: 5 | K31: Regenerace Staminy | L31: 10 | M31: 10 bodu/10sek
A32: + mass verze | B32: 5 | D32: + posileni +25% | E32: 5 | G32: + posileni +30% | H32: 5 | K32: Uhnuti uderu | L32: 30 | M32: 0.3
A33: Selfress -15 min CD | B33: 5 | D33: Unava/ vycerpani - mass | E33: 5 | G33: Bandage -20% delay | H33: 5 | K33: Absorbce | L33: 30 | M33: 0.2
A34: Bless - mass efekt | B34: 5 | D34: Zrcadlo - mass efekt | E34: 5 | G34: Crushing +15%dmg | H34: 5 | K34: Sani HP | L34: 20 | M34: 20% z rány
K35: Sani Staminy | L35: 20 | M35: 20% z rány
A36: Restoring shout | B36: 1 | D36: Shackle undead | E36: 1 | G36: Odhodlani | H36: 1 | K36: Sani many | L36: 20 | M36: 20% z rány
K37: Longrange | L37: 10
K38: Hazeni | L38: 10
B39: =SUM(B4:B38) -> 136 | E39: =SUM(E4:E38) -> 136 | H39: =SUM(H4:H38) -> 136 | K39: Blokace stitem | L39: 10
K40: Selfress | L40: 10
K42: Dmg za lvl | L42: 150 | M42: 1
L43: =SUM(L29:L42) -> 340
A45: Poznamka: | B45: ceny abilit budou nakonec stanoveny v absolutnich hodnotach, nikoliv v %
A46: Talenty | B46: Popis
A47: Omraceni | B47: - Aktivni abilita, aktivita zere staminu, bez CD, jen kladiva - sance dle materialu (copper 5%, 10, 12, 15, 18, 21 a 25%), ze cil bude omracen (3s) - Paralyza pri dalsim zraneni monstra prolomena
A48: Blokace stitem | B48: - Pasivni abilita pokud je equipnut stit - 10x body v abilite ---> sance 20% (25%) snizit PvM dmg o procentni cast dle materialu (Copper shield - 15, 20, 25, 30, 35, 40 a 50%)
A49: Bandage zrychleni | B49: - aktivni ablitita, bez CD - zapnuti sezere 10 staminy, talent spotrebovava staminu (spotrebu lze upgradnout). - pri zapnute abilite se zkracuje prodleva mezi pouzitim bandage a vylecenim cile (ne sebe)
A50: Armor of Faith | B50: - kouzlo - Navyseni PvM armoru, dispelnutelne - v zakladu 25% obleceneho armoru, upgrade na 50 a 75%
A51: Oziveni pres bandage | B51: - Schopnost klerika na oziveni hrace - kratky dosah, behem ozivovani pohyb = fizz - mozny upgrade
A52: Zvysena reg. many | B52: - aktivni ablitita, CD 20 minut - zapnuty talent spotrebovava staminu, pri nedostatku staminy se automaticky vypina. - po dobu aktivity se regenerace (abilita) ztrojnasobuje, nebere v potaz itemy!
A53: Shackle undead | B53: - aktivni ablitita, CD 5 minut - aktivace sezere 60% staminy, po dobu pusobeni zere staminu - undead na 1 minutu paralyzovan (pri zraneni monstra prolomena)
A54: Prorazeni AR | B54: - aktivni ablitita, CD 2 minuty, pouze kladiva - zapnuty talent spotrebovava staminu - +/- 5% (dle materialu) sance pøi úderu na snižení armoru monstra o 5% na 20 sekund - dalsim uspechem se nescita efekt, pouze prodluzuje sance
A55: Restoring shout | B55: - abilita, CD 5 minut, 50% stamina - kazdemu v dosahu klerika je obnoven jeho boost kouzlem (bless, int, str, vit, dex)
A56: Odhodlani | B56: - aktivni ablitita, CD 20 minut, jen melee dmg. - zapnuti sezere 1/2 staminy, talent spotrebovava staminu. - dmg je zvednuto o 80% na dobu 20 sekund.
A57: Regenerace HP, SP a MP | B57: - pasivni abilita - 1x bod ability = 1 regenerovany bod za 10 sekund - talenty je mozny upgrade (1x abilita = 2 regenerovane body)
A58: Uhnuti uderu | B58: - pasivni abilita - sance, ze postava zcela uhne uderu (melee nebo archery) - ruzna povolani maji ruzny strop (20-40%)
A59: Absorbce kouzla | B59: - pasivni abilita - sance, ze postava zcela absorbuje magicke dmg - ruzna povolani maji ruzny strop (20-40%)
A60: Sani HP, MP a SP | B60: - pasivni abilita - sance, ze postava uderem, kouzlem vysaje prislusne body z monstra (20% z rany, ale zaroven I porovnovat se stropem pro sani) - talenty je mozny upgrade
A61: Longrange | B61: - aktivni abilita, CD 2 minuty, sezere 1/2 maxstaminy, trva 10 sekund - Ranger/zlodej - prodluzuje dosah + 100% fizzuje kouzla - Warior - prodluzuje dosah leapu o 2 pole - Mystik - prodluzuje dosah + 100% fizzuje kouzla (dmg bez paralyzy)
A62: Hazeni | B62: - pasivni abilita - umoznuje hazet kudly a bomby
A63: Roundatack | B63: - aktivni abilita, CD 2 min, sezere 1/2 maxstaminy - umoznuje zasahnout vsehcno v okoli wariora (8 poli), 60% bezne rany - mozno upgradnout pres talent - pouze 2hand zbrane
A64: Bonus za level - damage | B64: - pasivni abilita, PvM - lze od lvlu 50, maximalne pocet bodu = lvl - 50 - kazdy bod zvedne o 0,5% PvM dmg, u kouzlivcu pres standcast.
A65: Unava/ vycerpani mass | B65: - Kouzlo (delsi casting time a mana), PvM - snizi pohyb monstra o 10%, mass efekt (uspesnost zavisla na vzdalenosti) - pri dalsim uspechu se efekt scita a timer nastavuje na delku posledniho zasazeni
A66: Unava/ vycerpani | B66: - Kouzlo, PvM - snizi pohyb monstra o 10% - pri dalsim uspechu se efekt scita a timer nastavuje na delku posledniho zasazeni
A67: Koncepce zpomaleni | B67: - jedno zpomaleni 5%-10% podle druhu - 1x druh zpomaleni = strop 20% - 2x druh zpomaleni = strop 25% + pomalejsi padani dolu - 3x druh zpomaleni = strop 35% + extra pomalejsi padani dolu
A68: Posileni/ oslabeni agra | B68: - pasivni abilita - kazdy uder zveda/snizuje agro o 20% silneji
A69: Drazdeni | B69: - aktivni abilita, zere staminu - po dobu trvani zapnuteho talentu je generovane agro +30%
A70: Zaujmuti monstra | B70: - aktivni abilita, CD 1 min, sezere 1/4 maxstaminy - sance ze monstrum bude nasledujicih 5 sekund utocit jen na tanka
A71: Silence | B71: - Aktivni abilita, spotrebovava manu, bez CD - Sance 10% u kouzla lightning na vyvolani silence u cile na 3 sekundy - pri dalsim uspechu se timer nastavuje na delku posledniho zasazeni
A72: Energy shield | B72: - Aktivni abilita, CD 4 min - Stit vykryva kouzla i rany - pouze PvM, HP stitu dle bodu v abilite (1=30 HP) - behem kouzla neni mozny pohyb a standcast, dale gatetravel a recall - stoji 1x amethyst, ubira 60 many
A73: Roar | B73: - aktivni abilita, CD 10 min, sezere 100% maxstaminy - monstra v dosahu se mohou vydesit (zmatene chodi a neutoci, delka dle uspechu) - uspesnost zavisla na vzdalenosti (a na uc? zbrani? Lvl?)
A74: Health recovery | B74: - aktivni abilita, CD 5 min, sezere 60% maxstaminy - po jednorazovem zraneni od monstra za vice nez 60% maxHP muze klerik aplikovat instatne sam sobe bandage (pak anbehne CD ability)
A75: Holy infusion | B75: - aktivni abilita, CD 10 min, sezere 1/2 maxstaminy - zapnuty talent spotrebovava staminu - abilita umoznuje posilit cil v boji proti nemrtvym (mozno seslat I na sebe) - Efekt: +25% (50%) zraneni zpusobeneho kouzlem, 30 sekund
A76: Holy weapon | B76: - aktivni ablitita, CD 5 minut, sezere 1/2 maxstaminy - zapnuty talent spotrebovava staminu - abilita umoznuje posilit klerika samotneho v boji s nemrtvymi - Efekt: +30% (60%) bonus vs undeads, 30 sekund
A77: Holy protection /mass | B77: - aktivni abilita, CD 5 min, sezere 1/2 maxstaminy - zapnuty talent spotrebovava staminu - abilita umoznuje ochranit cil/skupinu v boji proti nemrtvym (vcetne sebe) - Efekt: -15% zraneni zpusobeneho nemrtvymi, 60 sekund
A78: Selfresurrection | B78: - aktivni abilita, CD 60 (45) minut - Potreba: zapalena svicka zivota (hori 24 hodin), pri poklepani rekne kolik zbyva - sance na ozivnuti 10 bodu = 90%, druhy pokus za 2 minuty - oziveni az 10 sekund po smrti, po oziveni ma HP,SP a MP podle talentu