A2: Sorcerer | D2: Conjurer | G2: Magician | K2: Stavající stav
K3: Abilita | L3: pocet bodu | M3: efekt
A4: +10% dmg direkt | B4: 5 | D4: +2 summon | E4: 2 | G4: Mana do hole +40% | H4: 5 | K4: Regenerace Many | L4: 20 | M4: 20 bodu/10sek
A5: +30% setreni many | B5: 10 | D5: +20% HP elementals | E5: 5 | G5: Mana Shield | H5: 5 | K5: Regenerace zivotu | L5: 20 | M5: 20 bodu/10sek
A6: Meditace +50% mana | B6: 5 | D6: +20% HP Animals | E6: 5 | G6: MS - absorbce + 40% | H6: 5 | K6: Regenerace Staminy | L6: 20 | M6: 20 bodu/10sek
A7: Regenerace MP +10 | B7: 5 | D7: Regenerace HP +10 | E7: 5 | G7: Regenerace SP +10 | H7: 5 | K7: Uhnuti uderu | L7: 20 | M7: 0.2
A8: Protection +20% AR | B8: 5 | D8: Mana do hole +40% | E8: 5 | G8: Sani SP +10% | H8: 5 | K8: Absorbce | L8: 40 | M8: 0.4
A9: + ucenlivost +10% Inscr | B9: 5 | D9: + ucenlivost +10% Carth | E9: 5 | G9: + ucenlivost +10% Alch | H9: 5 | K9: Sani HP | L9: 20
A10: Agro -25% | B10: 5 | D10: Elementals +20% agro | E10: 5 | G10: Unava/ vycerpani | H10: 5
A11: Prvni stupen (bile) dostupny vsem vetvim, od druheho pouze pro danou vetev a specializaci | K11: Sani Staminy | L11: 20
A12: Standcast - posileni | B12: 5 | D12: Elementals -20% manacost | E12: 5 | G12: Vydrz zdi +30% | H12: 5 | K12: Sani many | L12: 20
A13: Sani MP +10% | B13: 5 | D13: Elem +20% dmg | E13: 5 | G13: Zdi -20% manacost | H13: 5 | K13: Longrange | L13: 10
A14: +15% setreni many | B14: 5 | D14: Sani many z summ. | E14: 5 | G14: Zvysena reg. many - aktiv. | H14: 5 | K14: Hazeni | L14: 10
A15: Energy wall -20%mana | B15: 5 | D15: Vortex +15% dmg | E15: 5 | G15: Gate travel - 15% mana | H15: 5 | K15: Energy shield | L15: 50 | M15: 350 HP
A16: Air - 15% manacost | B16: 5 | D16: Vortex -20% mana | E16: 5 | G16: Recall -25% mana | H16: 5
A17: Fire - 15% manacost | B17: 5 | D17: Fire - 20% manacost | E17: 5 | G17: Air - 20% manacost | H17: 5
L18: =SUM(L4:L17) -> 250
A19: Ignition - Meteor | B19: 5 | D19: Summon sani HP +25% | E19: 5 | G19: Paralyza -1 sek casting | H19: 5
A20: Ignition - efekt 5% | B20: 5 | D20: Summon +25% pohyb | E20: 5 | G20: Energyshield - posileni | H20: 5
A21: Silence - lightning | B21: 5 | D21: Ignition - Meteor | E21: 5 | G21: Cunning - INT+25% | H21: 5 | K21: SE
A22: Silence - delka efektu | B22: 5 | D22: Ignition - efekt 5% | E22: 5 | G22: + Zrcadlo - obnova boostu | H22: 5 | K22: Abilita | L22: pocet bodu | M22: efekt
A23: Energyshield - posileni | B23: 5 | D23: +2 summon | E23: 2 | G23: +1 summon | H23: 1 | K23: Regenerace Many | L23: 10 | M23: 10 bodu/10sek
K24: Regenerace zivotu | L24: 10 | M24: 10 bodu/10sek
A25: Magery mastery +5% | B25: 5 | D25: Demon | E25: 5 | G25: Magery mastery +10% | H25: 5 | K25: Regenerace Staminy | L25: 10 | M25: 10 bodu/10sek
A26: Mind blast - Feeblem. | B26: 5 | D26: Demon +20% HP | E26: 5 | G26: Resurrection | H26: 5 | K26: Uhnuti uderu | L26: 20 | M26: 0.2
A27: Mind blast -15%mana | B27: 5 | D27: Demon +20% dmg | E27: 5 | G27: Resurrection -20%mana | H27: 5 | K27: Absorbce | L27: 40 | M27: 0.4
A28: Direkt +20%dmg | B28: 5 | D28: Demon -20% mana | E28: 5 | G28: Air skola +20% dmg | H28: 5 | K28: Sani HP | L28: 10 | M28: 10% z rány | N28: upgrade na 20%
K29: Sani Staminy | L29: 10 | M29: 10% z rány | N29: upgrade na 20%
A30: Unava - stun 10% | B30: 5 | D30: Demon - scream | E30: 5 | G30: Unava/ vycerpani - mass | H30: 5 | K30: Sani many | L30: 10 | M30: 10% z rány | N30: upgrade na 20%
A31: Chain light. +2 targety | B31: 2 | D31: Meteor +20% dmg | E31: 5 | G31: Chain light. +20% dmg | H31: 5 | K31: Longrange | L31: 10
A32: Chain light. -20% mana | B32: 5 | D32: Meteor -20% mana | E32: 5 | G32: Chain light. -20% mana | H32: 5 | K32: Hazeni | L32: 10
A33: SC Freeze -1 sek | B33: 5 | D33: Fire skola +20% dmg | E33: 5 | G33: SC Freeze -1 sek | H33: 5 | K33: Standcast | L33: 10
K34: Energy shield | L34: 30
A35: Spell boost | B35: 1 | D35: Fontain of elements | E35: 1 | G35: Clearcast | H35: 1
K36: Dmg za lvl | L36: 150 | M36: 1
L37: =SUM(L23:L36) -> 330
B38: =SUM(B4:B35) -> 133 | E38: =SUM(E4:E35) -> 125 | H38: =SUM(H4:H35) -> 127
A39: mamrd 1x | D39: Daemon jen 1x
A41: Poznamka: | B41: ceny abilit budou nakonec stanoveny v absolutnich hodnotach, nikoliv v %
A42: Talenty | B42: Popis
A43: Koncepce zpomaleni | B43: - jedno zpomaleni 5%-10% podle druhu - 1x druh zpomaleni = strop 20% - 2x druh zpomaleni = strop 25% + pomalejsi padani dolu - 3x druh zpomaleni = strop 35% + extra pomalejsi padani dolu | J43: Kouzlo - 10% zapomaleni/kouzlo Jed - 5% zapomaleni /uder Uder - 7% zapomaleni / uder
A44: Unava/ vycerpani (jen PvM) | B44: - Kouzlo, PvM - snizi pohyb monstra o 10% - pri dalsim uspechu se efekt scita a timer nastavuje na delku posledniho zasazeni - uprade - 10% sance na stun 2 sek (dmg jej prolomi)
A45: Unava/ vycerpani mass - (jen PvM) | B45: - Kouzlo (delsi casting time a mana), PvM - snizi pohyb monstra o 10%, mass efekt (uspesnost zavisla na vzdalenosti) - pri dalsim uspechu se efekt scita a timer nastavuje na delku posledniho zasazeni
A46: Manashield (i PvP) | B46: - kouzlo, PvP - po zapnuti jsou misto HP ubirany MP, max 1 min. - zakouzleni kouzla shazuje manashield
A47: Fontain of elements | B47: - Premena elementala na fontanu - V prubehu spotrebovava staminu, pri nedostatku staminy se automaticky vypina. - po dobu existence fontany (30 sekund) ma skupina v dosahu bonus - dle typu elementala - Air - DEX, Earth - STR, Water - VIT, Fire - INT
A48: Ignition | B48: - Aktivni abilita, spotrebovava manu, bez CD - Sance u prislusneho kouzla na zapaleni cile (prvni definuji sanci) - cil na sobe ma DOT dmg, kteru postupne slabne (druhe definuji silu) - pri dalsim uspechu se DOT scitaji a timer restartuje (jako bleed)
A49: Silence | B49: - Aktivni abilita, spotrebovava manu, bez CD - Sance 10% u kouzla lightning na vyvolani silence. - druhe body prodluzuji efekt - pri dalsim uspechu se timer nastavuje na delku posledniho zasazeni
A50: Setreni many | B50: - aktivni ablitita, bez CD - sance na to, ze pri uspechu je vraceno 90% many z vyvolaneho kouzla - zapnuty talent spotrebovava staminu, pri nedostatku staminy se automaticky vypina.
A51: Sani many ze summonu | B51: - aktivni ablitita, CD 2 minuty - zapnuty talent spotrebovava staminu, pri nedostatku staminy se automaticky vypina. - pri zapnuti se nekromantovi zvysi manaregen, velikost zavisla na aktualnim poctu summonu
A52: Spellboost (mage) | B52: - aktivni ablitita, CD 15 minut - zapnuty talent spotrebovava staminu, pri nedostatku staminy se automaticky vypina. - po dobu 20 sekund zvyseno dmg z kouzel o 60%
A53: Zvysena reg. many | B53: - aktivni ablitita, CD 20 minut - zapnuty talent spotrebovava staminu, pri nedostatku staminy se automaticky vypina. - po dobu aktivity se regenerace (abilita) ztrojnasobuje, nebere v potaz itemy!
A54: Summon sani HP | B54: - aktivni ablitita, CD 10 minut - zapnuty talent spotrebovava staminu, pri nedostatku staminy se automaticky vypina. - summoni sajou z cilu HP - leci se - 25% sveho dmg
A55: Clearcast | B55: - aktivni ablitita, CD 15 minut - zapnuty talent spotrebovava staminu, pri nedostatku staminy se automaticky vypina. - po dobu 30 sekund vsechny kouzla za 0 many
A56: Standcast | B56: - do dmg kouzla je pripocten bonus za lvl castera, PvM only - v prubehu kouzla neni mozny pohyb, fizz kouzla = prodlouzeni freezetimeru o 3 sek - nutno aktivovat pred kazdym kouzlem (aktivace 5% max staminy)
A57: Zrcadlo Obnova boostu | B57: - aktivni ablitita, bez CD (pouze na kouzlene boosty - str, int, dex, vit a bless) - zapnuty talent spotrebovava staminu, pri nedostatku staminy se automaticky vypina. - 40% sance, ze pri zakouzleni zrcadla bude prodlouzen timer boostu jako u noveho.
A58: Energy shield | B58: - Aktivni abilita, CD 4 min - Stit vykryva kouzla i rany - pouze PvM, HP stitu dle bodu v abilite (1=30 HP) - behem kouzla neni mozny pohyb a standcast, dale gatetravel a recall - stoji 1x amethyst, ubira 60 many
A59: Mind blast Feeblemind | B59: - aktivni ablitita, CD 2 minuty, PvM - zapnuty talent spotrebovava staminu, pri nedostatku staminy se automaticky vypina. - 60% sance, ze pri zakouzleni MB bude pridano I prokleti feeblemind (na INT)
A60: Longrange | B60: - aktivni abilita, CD 2 minuty, sezere 1/2 maxstaminy, trva 10 sekund - Ranger/zlodej - prodluzuje dosah + 100% fizzuje kouzla - Warior - prodluzuje dosah leapu o 2 pole - Mystik - prodluzuje dosah + 100% fizzuje kouzla (dmg bez paralyzy)
A61: Daemon - scream | B61: - abilita summona, 1 min - vsechna monstra v dosahu obrati pozornost na summona - uspesnost zavisla na vzdalenosti a na monstru
A63: Talenty - pasivni | B63: Popis
A64: Regenerace HP, SP a MP | B64: - pasivni abilita - 1x bod ability = 1 regenerovany bod za 10 sekund - talenty je mozny upgrade (1x abilita = 2 regenerovane body)
A65: Uhnuti uderu | B65: - pasivni abilita - sance, ze postava zcela uhne uderu (melee nebo archery) - ruzna povolani maji ruzny strop (20-40%)
A66: Absorbce kouzla | B66: - pasivni abilita - sance, ze postava zcela absorbuje magicke dmg - ruzna povolani maji ruzny strop (20-40%)
A67: Sani HP, MP a SP | B67: - pasivni abilita - sance, ze postava uderem, kouzlem vysaje prislusne body z monstra (20% z rany, ale zaroven I porovnovat se stropem pro sani) - talenty je mozny upgrade
A68: Hazeni | B68: - pasivni abilita - umoznuje hazet kudly a bomby
A69: Bonus za level - damage | B69: - pasivni abilita, PvM - lze od lvlu 50, maximalne pocet bodu = lvl - 50 - kazdy bod zvedne o 0,5% PvM dmg, u kouzlivcu pres standcast.